Source.Name,Site,Parameter,Date (LST),Year,Month,Day,Hour,Date Key,Value,Unit,AQI,Duration,USAF,WBAN,Date Key.1,DIR,SPD,GUS,CLG,SKC,L,M,H,VSB,MW,MW_1,MW_2,MW_3,AW,AW_4,AW_5,AW_6,W,TEMP,DEWP,SLP,ALT,STP,MAX,MIN,PCP01,PCP06,PCP24,PCPXX,SD
Ulaanbaatar_ HourlyPM25_201510.CSV,Ulaanbaatar,2/5/2018 12:00,10/1/2015 0:00,2015,1,1,0,2.02E+11,0.176,mg/m³,50,1 Hr,442920,99999,2.02E+11,,,,250,,,,,12.5,4,,,,,,,,2,35,23,1022.4,30,,,30,,,,,
Ulaanbaatar_ HourlyPM25_201510.CSV,Ulaanbaatar,2/5/2018 12:00,10/1/2015 1:00,2015,1,1,1,2.02E+11,0.071,mg/m³,60,1 Hr,442920,99999,2.02E+11,,0,,250,,,,,6.2,,,,,,,,,,36,27,,30,,,,,,,,
Ulaanbaatar_ HourlyPM25_201510.CSV,Ulaanbaatar,2/5/2018 12:00,10/1/2015 2:00,2015,1,1,2,2.02E+11,0.077,mg/m³,70,1 Hr,442920,99999,2.02E+11,,0,,,,,,,6.2,,,,,,,,,,43,27,,30,,,,,,,,
Ulaanbaatar_ HourlyPM25_201510.CSV,Ulaanbaatar,2/5/2018 12:00,10/1/2015 3:00,2015,1,1,3,2.02E+11,0.058,mg/m³,80,1 Hr,442920,99999,2.02E+11,210,4,,,BKN,,,,31.2,,,,,,,,,,47,29,1017,,867.8,,,,,,,
Ulaanbaatar_ HourlyPM25_201510.CSV,Ulaanbaatar,2/5/2018 12:00,10/1/2015 4:00,2015,1,1,4,2.02E+11,0.056,mg/m³,90,1 Hr,442920,99999,2.02E+11,990,11,,,,,,,6.2,,,,,,,,,,52,30,,29.91,,,,,,,,
Ulaanbaatar_ HourlyPM25_201510.CSV,Ulaanbaatar,2/5/2018 12:00,10/1/2015 5:00,2015,1,1,5,2.02E+11,0.036,mg/m³,100,1 Hr,442920,99999,2.02E+11,270,16,,,,,,,6.2,,,,,,,,,,55,30,,29.88,,,,,,,,
Ulaanbaatar_ HourlyPM25_201510.CSV,Ulaanbaatar,2/5/2018 12:00,10/1/2015 6:00,2015,1,1,6,2.02E+11,0.03,mg/m³,110,1 Hr,442920,99999,2.02E+11,250,18,,,,,,,6.2,,,,,,,,,,57,30,1010,29.85,,,,,,,,
Ulaanbaatar_ HourlyPM25_201510.CSV,Ulaanbaatar,2/5/2018 12:00,10/1/2015 7:00,2015,1,1,7,2.02E+11,0.044,mg/m³,120,1 Hr,442920,99999,2.02E+11,990,22,,,,,,,6.2,,,,,,,,,,57,28,,29.83,,,,,,,,
Ulaanbaatar_ HourlyPM25_201510.CSV,Ulaanbaatar,2/5/2018 12:00,10/1/2015 8:00,2015,1,1,8,2.02E+11,0.103,mg/m³,130,1 Hr,442920,99999,2.02E+11,300,22,,,,,,,6.2,,,,,,,,,,61,30,,29.83,,,,,,,,
Ulaanbaatar_ HourlyPM25_201510.CSV,Ulaanbaatar,2/5/2018 12:00,10/1/2015 9:00,2015,1,1,9,2.02E+11,0.176,mg/m³,140,1 Hr,442920,99999,2.02E+11,270,16,,,,,,,6.2,2,,,,,,,,3,59,28,1008.2,29.83,,,,,,,,
Ulaanbaatar_ HourlyPM25_201510.CSV,Ulaanbaatar,2/5/2018 12:00,10/1/2015 10:00,2015,1,1,10,2.02E+11,0.176,mg/m³,50,1 Hr,442920,99999,2.02E+11,290,16,,,,,,,6.2,,,,,,,,,,57,32,,29.8,,,,,,,,
Ulaanbaatar_ HourlyPM25_201510.CSV,Ulaanbaatar,2/5/2018 12:00,10/1/2015 11:00,2015,1,1,11,2.02E+11,0.071,mg/m³,60,1 Hr,442920,99999,2.02E+11,990,4,,,,,,,6.2,,,,,,,,,,52,34,,29.83,,,,,,,,
Ulaanbaatar_ HourlyPM25_201510.CSV,Ulaanbaatar,2/5/2018 12:00,10/1/2015 12:00,2015,1,1,12,2.02E+11,0.077,mg/m³,70,1 Hr,442920,99999,2.02E+11,,,,,,,,,31.2,,,,,,,,,,50,32,1011,29.83,,60,,,,,,
Ulaanbaatar_ HourlyPM25_201510.CSV,Ulaanbaatar,2/5/2018 12:00,10/1/2015 13:00,2015,1,1,13,2.02E+11,0.058,mg/m³,80,1 Hr,442920,99999,2.02E+11,990,16,31,,,,,,6.2,,,,,,,,,,48,34,,29.85,,,,,,,,
Ulaanbaatar_ HourlyPM25_201510.CSV,Ulaanbaatar,2/5/2018 12:00,10/1/2015 14:00,2015,1,1,14,2.02E+11,0.056,mg/m³,90,1 Hr,442920,99999,2.02E+11,350,4,,,,,,,6.2,,,,,,,,,,46,34,,29.85,,,,,,,,
Ulaanbaatar_ HourlyPM25_201510.CSV,Ulaanbaatar,2/5/2018 12:00,10/1/2015 15:00,2015,1,1,15,2.02E+11,0.036,mg/m³,100,1 Hr,442920,99999,2.02E+11,300,4,,,,,,,31.2,,,,,,,,,,37,34,1014.1,29.85,,,,,,,,
Ulaanbaatar_ HourlyPM25_201510.CSV,Ulaanbaatar,2/5/2018 12:00,10/1/2015 16:00,2015,1,1,16,2.02E+11,0.03,mg/m³,110,1 Hr,442920,99999,2.02E+11,,0,,,,,,,,,,,,,,,,,37,32,,29.85,,,,,,,,
Ulaanbaatar_ HourlyPM25_201510.CSV,Ulaanbaatar,2/5/2018 12:00,10/1/2015 17:00,2015,1,1,17,2.02E+11,0.044,mg/m³,120,1 Hr,442920,99999,2.02E+11,990,2,,,,,,,,,,,,,,,,,34,30,,29.85,,,,,,,,
Ulaanbaatar_ HourlyPM25_201510.CSV,Ulaanbaatar,2/5/2018 12:00,10/1/2015 18:00,2015,1,1,18,2.02E+11,0.103,mg/m³,130,1 Hr,442920,99999,2.02E+11,,,,,,,,,31.2,,,,,,,,,,37,30,1017,,865.3,,,,,,,
Ulaanbaatar_ HourlyPM25_201510.CSV,Ulaanbaatar,2/5/2018 12:00,10/1/2015 19:00,2015,1,1,19,2.02E+11,0.176,mg/m³,140,1 Hr,442920,99999,2.02E+11,990,4,,,,,,,,,,,,,,,,,32,30,,29.88,,,,,,,,
Ulaanbaatar_ HourlyPM25_201510.CSV,Ulaanbaatar,2/5/2018 12:00,10/1/2015 20:00,2015,1,1,20,2.02E+11,0.176,mg/m³,50,1 Hr,442920,99999,2.02E+11,990,4,,,,,,,,,,,,,,,,,30,28,,29.88,,,,,,,,
Ulaanbaatar_ HourlyPM25_201510.CSV,Ulaanbaatar,2/5/2018 12:00,10/1/2015 21:00,2015,1,1,21,2.02E+11,0.071,mg/m³,60,1 Hr,442920,99999,2.02E+11,,,,,,,,,31.2,,,,,,,,,,36,30,1018.3,,866.1,,,,,,,
Ulaanbaatar_ HourlyPM25_201510.CSV,Ulaanbaatar,2/5/2018 12:00,10/1/2015 22:00,2015,1,1,22,2.02E+11,0.077,mg/m³,70,1 Hr,442920,99999,2.02E+11,,0,,,,,,,,,,,,,,,,,32,28,,29.91,,,,,,,,
Ulaanbaatar_ HourlyPM25_201510.CSV,Ulaanbaatar,2/5/2018 12:00,10/1/2015 23:00,2015,1,1,23,2.02E+11,0.058,mg/m³,80,1 Hr,442920,99999,2.02E+11,990,2,,,,,,,,,,,,,,,,,28,25,,29.94,,,,,,,,
Ulaanbaatar_ HourlyPM25_201510.CSV,Ulaanbaatar,2/5/2018 12:00,10/2/2015 0:00,2015,2,2,0,2.02E+11,0.056,mg/m³,90,1 Hr,442920,99999,2.02E+11,280,4,,,,,,,12.5,4,,,,,,,,0,38,28,1019.8,29.97,,,36,,,,,
Ulaanbaatar_ HourlyPM25_201510.CSV,Ulaanbaatar,2/5/2018 12:00,10/2/2015 1:00,2015,2,2,1,2.02E+11,0.036,mg/m³,100,1 Hr,442920,99999,2.02E+11,,0,,,,,,,,,,,,,,,,,37,30,,29.97,,,,,,,,
Ulaanbaatar_ HourlyPM25_201510.CSV,Ulaanbaatar,2/5/2018 12:00,10/2/2015 2:00,2015,2,2,2,2.02E+11,0.03,mg/m³,110,1 Hr,442920,99999,2.02E+11,990,2,,,,,,,,,,,,,,,,,43,30,,30,,,,,,,,
Ulaanbaatar_ HourlyPM25_201510.CSV,Ulaanbaatar,2/5/2018 12:00,10/2/2015 3:00,2015,2,2,3,2.02E+11,0.044,mg/m³,120,1 Hr,442920,99999,2.02E+11,310,9,,,,,,,6.2,4,,,,,,,,0,46,30,1017.8,30,,,,,,,,
Ulaanbaatar_ HourlyPM25_201510.CSV,Ulaanbaatar,2/5/2018 12:00,10/2/2015 4:00,2015,2,2,4,2.02E+11,0.103,mg/m³,130,1 Hr,442920,99999,2.02E+11,990,11,,,,,,,,,,,,,,,,,50,30,,29.97,,,,,,,,
Ulaanbaatar_ HourlyPM25_201510.CSV,Ulaanbaatar,2/5/2018 12:00,10/2/2015 5:00,2015,2,2,5,2.02E+11,0.176,mg/m³,140,1 Hr,442920,99999,2.02E+11,990,7,,,,,,,,,,,,,,,,,54,28,,29.97,,,,,,,,
Ulaanbaatar_ HourlyPM25_201510.CSV,Ulaanbaatar,2/5/2018 12:00,10/2/2015 6:00,2015,2,2,6,2.02E+11,0.176,mg/m³,50,1 Hr,442920,99999,2.02E+11,990,11,,,SCT,,,,6.2,,,,,,,,,,54,30,1015,,868.2,,,,,,,
Ulaanbaatar_ HourlyPM25_201510.CSV,Ulaanbaatar,2/5/2018 12:00,10/2/2015 7:00,2015,2,2,7,2.02E+11,0.071,mg/m³,60,1 Hr,442920,99999,2.02E+11,990,7,,,,,,,6.2,,,,,,,,,,55,30,,29.97,,,,,,,,
Ulaanbaatar_ HourlyPM25_201510.CSV,Ulaanbaatar,2/5/2018 12:00,10/2/2015 8:00,2015,2,2,8,2.02E+11,0.077,mg/m³,70,1 Hr,442920,99999,2.02E+11,990,9,,,,,,,6.2,,,,,,,,,,55,28,,29.97,,,,,,,,
Ulaanbaatar_ HourlyPM25_201510.CSV,Ulaanbaatar,2/5/2018 12:00,10/2/2015 9:00,2015,2,2,9,2.02E+11,0.058,mg/m³,80,1 Hr,442920,99999,2.02E+11,990,13,,,,,,,6.2,,,,,,,,,,57,27,1013.7,29.97,,,,,,,,
Ulaanbaatar_ HourlyPM25_201510.CSV,Ulaanbaatar,2/5/2018 12:00,10/2/2015 10:00,2015,2,2,10,2.02E+11,0.056,mg/m³,90,1 Hr,442920,99999,2.02E+11,290,11,,,,,,,6.2,,,,,,,,,,54,27,,29.97,,,,,,,,
Ulaanbaatar_ HourlyPM25_201510.CSV,Ulaanbaatar,2/5/2018 12:00,10/2/2015 11:00,2015,2,2,11,2.02E+11,0.036,mg/m³,100,1 Hr,442920,99999,2.02E+11,990,2,,,,,,,6.2,,,,,,,,,,48,30,,29.97,,,,,,,,
Ulaanbaatar_ HourlyPM25_201510.CSV,Ulaanbaatar,2/5/2018 12:00,10/2/2015 12:00,2015,2,2,12,2.02E+11,0.03,mg/m³,110,1 Hr,442920,99999,2.02E+11,990,2,,,,,,,31.2,,,,,,,,,,46,30,1018.7,,869.1,58,,,,,,
Ulaanbaatar_ HourlyPM25_201510.CSV,Ulaanbaatar,2/5/2018 12:00,10/2/2015 13:00,2015,2,2,13,2.02E+11,0.044,mg/m³,120,1 Hr,442920,99999,2.02E+11,160,4,,,,,,,,,,,,,,,,,39,30,,30,,,,,,,,
Ulaanbaatar_ HourlyPM25_201510.CSV,Ulaanbaatar,2/5/2018 12:00,10/2/2015 14:00,2015,2,2,14,2.02E+11,0.103,mg/m³,130,1 Hr,442920,99999,2.02E+11,,0,,,,,,,,,,,,,,,,,37,30,,30,,,,,,,,
Ulaanbaatar_ HourlyPM25_201510.CSV,Ulaanbaatar,2/5/2018 12:00,10/2/2015 15:00,2015,2,2,15,2.02E+11,0.176,mg/m³,140,1 Hr,442920,99999,2.02E+11,,,,,,,,,31.2,,,,,,,,,,36,28,1021.2,30,,,,,,,,
Ulaanbaatar_ HourlyPM25_201510.CSV,Ulaanbaatar,2/5/2018 12:00,10/2/2015 16:00,2015,2,2,16,2.02E+11,0.176,mg/m³,50,1 Hr,442920,99999,2.02E+11,,0,,,,,,,,,,,,,,,,,32,28,,30.03,,,,,,,,
Ulaanbaatar_ HourlyPM25_201510.CSV,Ulaanbaatar,2/5/2018 12:00,10/2/2015 17:00,2015,2,2,17,2.02E+11,0.071,mg/m³,60,1 Hr,442920,99999,2.02E+11,,0,,,,,,,,,,,,,,,,,30,28,,30.03,,,,,,,,
Ulaanbaatar_ HourlyPM25_201510.CSV,Ulaanbaatar,2/5/2018 12:00,10/2/2015 18:00,2015,2,2,18,2.02E+11,0.077,mg/m³,70,1 Hr,442920,99999,2.02E+11,80,2,,,,,,,31.2,,,,,,,,,,38,27,1022.3,30.03,,,,,,,,
Ulaanbaatar_ HourlyPM25_201510.CSV,Ulaanbaatar,2/5/2018 12:00,10/2/2015 19:00,2015,2,2,19,2.02E+11,0.058,mg/m³,80,1 Hr,442920,99999,2.02E+11,,0,,,,,,,,,,,,,,,,,28,27,,30.03,,,,,,,,
Ulaanbaatar_ HourlyPM25_201510.CSV,Ulaanbaatar,2/5/2018 12:00,10/2/2015 20:00,2015,2,2,20,2.02E+11,0.056,mg/m³,90,1 Hr,442920,99999,2.02E+11,,0,,,,,,,,,,,,,,,,,27,25,,30.03,,,,,,,,
Ulaanbaatar_ HourlyPM25_201510.CSV,Ulaanbaatar,2/5/2018 12:00,10/2/2015 21:00,2015,2,2,21,2.02E+11,0.036,mg/m³,100,1 Hr,442920,99999,2.02E+11,,,,,,,,,31.2,,,,,,,,,,27,25,1023.4,30.03,,,,,,,,
Ulaanbaatar_ HourlyPM25_201510.CSV,Ulaanbaatar,2/5/2018 12:00,10/2/2015 22:00,2015,2,2,22,2.02E+11,0.03,mg/m³,110,1 Hr,442920,99999,2.02E+11,,0,,,,,,,,,,,,,,,,,27,23,,30.03,,,,,,,,
Ulaanbaatar_ HourlyPM25_201510.CSV,Ulaanbaatar,2/5/2018 12:00,10/2/2015 23:00,2015,2,2,23,2.02E+11,0.044,mg/m³,120,1 Hr,442920,99999,2.02E+11,,0,,,,,,,,,,,,,,,,,25,23,,30.03,,,,,,,,
Ulaanbaatar_ HourlyPM25_201510.CSV,Ulaanbaatar,2/5/2018 12:00,10/3/2015 0:00,2015,3,3,0,2.02E+11,0.103,mg/m³,130,1 Hr,442920,99999,2.02E+11,,,,,SCT,,,,6.2,4,,,,,,,,0,28,27,1023.4,30.03,,,,,,,,
Ulaanbaatar_ HourlyPM25_201510.CSV,Ulaanbaatar,2/5/2018 12:00,10/19/2015 17:00,2015,10,19,17,2.02E+11,0.021,mg/mÂ³,70,1 Hr,442920,99999,2.02E+11,990,2,,,,,,,6.2,,,,,,,,,,28,16,,30.06,,,,,,,,
Ulaanbaatar_ HourlyPM25_201510.CSV,Ulaanbaatar,2/5/2018 12:00,10/19/2015 22:00,2015,10,19,22,2.02E+11,0.084,mg/mÂ³,166,1 Hr,442920,99999,2.02E+11,990,2,,,,,,,,,,,,,,,,,18,10,,30.09,,,,,,,,
Ulaanbaatar_ HourlyPM25_201510.CSV,Ulaanbaatar,2/5/2018 12:00,10/20/2015 0:00,2015,10,20,1,2.02E+11,0.061,mg/mÂ³,154,1 Hr,442920,99999,2.02E+11,,,,,,,,,6.2,4,,,,,,,,0,18,15,1028.8,30.12,,,,,,,,
Ulaanbaatar_ HourlyPM25_201510.CSV,Ulaanbaatar,2/5/2018 12:00,10/20/2015 2:00,2015,10,20,2,2.02E+11,0.048,mg/mÂ³,132,1 Hr,442920,99999,2.02E+11,,0,,,,,,,5,,,,,,,,,,30,16,,30.15,,,,,,,,
Ulaanbaatar_ HourlyPM25_201510.CSV,Ulaanbaatar,2/5/2018 12:00,10/20/2015 5:00,2015,10,20,5,2.02E+11,0.032,mg/mÂ³,93,1 Hr,442920,99999,2.02E+11,990,4,,,,,,,6.2,,,,,,,,,,41,23,,30.09,,,,,,,,
Ulaanbaatar_ HourlyPM25_201510.CSV,Ulaanbaatar,2/5/2018 12:00,10/20/2015 8:00,2015,10,20,8,2.02E+11,0.071,mg/mÂ³,159,1 Hr,442920,99999,2.02E+11,990,11,22,33,,,,,6.2,,,,,,,,,,39,30,,30.06,,,,,,,,
Ulaanbaatar_ HourlyPM25_201510.CSV,Ulaanbaatar,2/5/2018 12:00,10/20/2015 9:00,2015,10,20,9,2.02E+11,0.158,mg/mÂ³,208,1 Hr,442920,99999,2.02E+11,990,16,,33,BKN,,,,6.2,15,,,,,,,,2,40,29,1023.7,,871.7,,,,,,,
Ulaanbaatar_ HourlyPM25_201510.CSV,Ulaanbaatar,2/5/2018 12:00,10/20/2015 10:00,2015,10,20,10,2.02E+11,0.052,mg/mÂ³,142,1 Hr,442920,99999,2.02E+11,990,7,,33,,,,,6.2,,,,,,,,,,36,32,,30.09,,,,,,,,
Ulaanbaatar_ HourlyPM25_201510.CSV,Ulaanbaatar,2/5/2018 12:00,10/20/2015 11:00,2015,10,20,11,2.02E+11,0.039,mg/mÂ³,110,1 Hr,442920,99999,2.02E+11,990,2,,33,,,,,6.2,,,,,,,,,,34,30,,30.09,,,,,,,,
Ulaanbaatar_ HourlyPM25_201510.CSV,Ulaanbaatar,2/5/2018 12:00,10/20/2015 12:00,2015,10,20,12,2.02E+11,0.055,mg/mÂ³,149,1 Hr,442920,99999,2.02E+11,,,,,,,,,6.2,1,,,,,,,,8,28,25,1027.1,30.12,,46,,,,,0.02,
Ulaanbaatar_ HourlyPM25_201510.CSV,Ulaanbaatar,2/5/2018 12:00,10/20/2015 13:00,2015,10,20,13,2.02E+11,0.055,mg/mÂ³,149,1 Hr,442920,99999,2.02E+11,990,4,,,,,,,6.2,,,,,,,,,,25,23,,30.15,,,,,,,,
Ulaanbaatar_ HourlyPM25_201510.CSV,Ulaanbaatar,2/5/2018 12:00,10/20/2015 14:00,2015,10,20,14,2.02E+11,0.023,mg/mÂ³,74,1 Hr,442920,99999,2.02E+11,190,4,,,,,,,,,,,,,,,,,23,19,,30.15,,,,,,,,
Ulaanbaatar_ HourlyPM25_201510.CSV,Ulaanbaatar,2/5/2018 12:00,10/20/2015 15:00,2015,10,20,15,2.02E+11,0.019,mg/mÂ³,66,1 Hr,442920,99999,2.02E+11,,,,,,,,,6.2,,,,,,,,,,23,21,1030.1,30.18,,,,,,,,
Ulaanbaatar_ HourlyPM25_201510.CSV,Ulaanbaatar,2/5/2018 12:00,10/20/2015 16:00,2015,10,20,16,2.02E+11,0.023,mg/mÂ³,74,1 Hr,442920,99999,2.02E+11,990,2,,,,,,,6.2,,,,,,,,,,21,18,,30.18,,,,,,,,
Ulaanbaatar_ HourlyPM25_201510.CSV,Ulaanbaatar,2/5/2018 12:00,10/20/2015 17:00,2015,10,20,17,2.02E+11,0.026,mg/mÂ³,80,1 Hr,442920,99999,2.02E+11,,0,,,,,,,,,,,,,,,,,18,16,,30.18,,,,,,,,
Ulaanbaatar_ HourlyPM25_201510.CSV,Ulaanbaatar,2/5/2018 12:00,10/20/2015 18:00,2015,10,20,18,2.02E+11,0.028,mg/mÂ³,84,1 Hr,442920,99999,2.02E+11,,,,,,,,,31.2,,,,,,,,,,16,14,1031.3,30.18,,,,,,,,
Ulaanbaatar_ HourlyPM25_201510.CSV,Ulaanbaatar,2/5/2018 12:00,10/20/2015 19:00,2015,10,20,19,2.02E+11,0.029,mg/mÂ³,87,1 Hr,442920,99999,2.02E+11,990,2,,,,,,,,,,,,,,,,,18,14,,30.21,,,,,,,,
Ulaanbaatar_ HourlyPM25_201510.CSV,Ulaanbaatar,2/5/2018 12:00,10/20/2015 20:00,2015,10,20,20,2.02E+11,0.146,mg/mÂ³,198,1 Hr,442920,99999,2.02E+11,,0,,,,,,,,,,,,,,,,,16,14,,30.21,,,,,,,,
Ulaanbaatar_ HourlyPM25_201510.CSV,Ulaanbaatar,2/5/2018 12:00,10/20/2015 21:00,2015,10,20,21,2.02E+11,0.133,mg/mÂ³,191,1 Hr,442920,99999,2.02E+11,,,,,,,,,31.2,,,,,,,,,,14,12,1033.2,30.21,,,,,,,,
Ulaanbaatar_ HourlyPM25_201510.CSV,Ulaanbaatar,2/5/2018 12:00,10/20/2015 22:00,2015,10,20,22,2.02E+11,0.095,mg/mÂ³,171,1 Hr,442920,99999,2.02E+11,990,2,,,,,,,,,,,,,,,,,12,10,,30.21,,,,,,,,
Ulaanbaatar_ HourlyPM25_201510.CSV,Ulaanbaatar,2/5/2018 12:00,10/20/2015 23:00,2015,10,20,23,2.02E+11,0.108,mg/mÂ³,178,1 Hr,442920,99999,2.02E+11,,0,,,,,,,5,,,,,,,,,,14,12,,30.21,,,,,,,,
Ulaanbaatar_ HourlyPM25_201510.CSV,Ulaanbaatar,2/5/2018 12:00,10/21/2015 0:00,2015,10,21,0,2.02E+11,0.116,mg/mÂ³,182,1 Hr,442920,99999,2.02E+11,,,,,,,,,0.6,44,4,,,,,,,0,16,14,1034.3,30.21,,,,,,,,
Ulaanbaatar_ HourlyPM25_201510.CSV,Ulaanbaatar,2/5/2018 12:00,10/21/2015 1:00,2015,10,21,1,2.02E+11,0,mg/mÂ³,26,1 Hr,442920,99999,2.02E+11,990,2,,,,,,,0.8,4,10,,,,,,,,21,19,,30.24,,,,,,,,
Ulaanbaatar_ HourlyPM25_201510.CSV,Ulaanbaatar,2/5/2018 12:00,10/21/2015 2:00,2015,10,21,2,2.02E+11,0.077,mg/mÂ³,162,1 Hr,442920,99999,2.02E+11,990,2,,,,,,,1.2,4,10,,,,,,,,23,21,,30.24,,,,,,,,
Ulaanbaatar_ HourlyPM25_201510.CSV,Ulaanbaatar,2/5/2018 12:00,10/21/2015 3:00,2015,10,21,3,2.02E+11,0.058,mg/mÂ³,152,1 Hr,442920,99999,2.02E+11,80,4,,,,,,,0.3,44,4,,,,,,,7,25,23,1031.9,30.24,,,,,,,,
Ulaanbaatar_ HourlyPM25_201510.CSV,Ulaanbaatar,2/5/2018 12:00,10/21/2015 4:00,2015,10,21,4,2.02E+11,0.056,mg/mÂ³,151,1 Hr,442920,99999,2.02E+11,990,2,,,,,,,2,4,10,,,,,,,,28,27,,30.21,,,,,,,,
Ulaanbaatar_ HourlyPM25_201510.CSV,Ulaanbaatar,2/5/2018 12:00,10/21/2015 5:00,2015,10,21,5,2.02E+11,0.068,mg/mÂ³,157,1 Hr,442920,99999,2.02E+11,990,2,,722,CLR,,,,3.8,,,,,,,,,,37,27,,30.18,,,,,,,,
Ulaanbaatar_ HourlyPM25_201510.CSV,Ulaanbaatar,2/5/2018 12:00,10/21/2015 6:00,2015,10,21,6,2.02E+11,0.056,mg/mÂ³,151,1 Hr,442920,99999,2.02E+11,990,9,,,,,,,2.5,4,,,,,,,,7,45,18,1024.6,30.15,,,,,,,,
Ulaanbaatar_ HourlyPM25_201510.CSV,Ulaanbaatar,2/5/2018 12:00,10/21/2015 7:00,2015,10,21,7,2.02E+11,0.063,mg/mÂ³,155,1 Hr,442920,99999,2.02E+11,240,13,,,,,,,,,,,,,,,,,46,16,,30.12,,,,,,,,
Ulaanbaatar_ HourlyPM25_201510.CSV,Ulaanbaatar,2/5/2018 12:00,10/21/2015 8:00,2015,10,21,8,2.02E+11,0.059,mg/mÂ³,153,1 Hr,442920,99999,2.02E+11,240,13,,,,,,,,,,,,,,,,,48,14,,30.12,,,,,,,,
Ulaanbaatar_ HourlyPM25_201510.CSV,Ulaanbaatar,2/5/2018 12:00,10/21/2015 9:00,2015,10,21,9,2.02E+11,0.057,mg/mÂ³,152,1 Hr,442920,99999,2.02E+11,240,13,,,SCT,,,,6.2,4,,,,,,,,0,46,14,1021.2,30.09,,,,,,,,
Ulaanbaatar_ HourlyPM25_201510.CSV,Ulaanbaatar,2/5/2018 12:00,10/21/2015 10:00,2015,10,21,10,2.02E+11,0.057,mg/mÂ³,152,1 Hr,442920,99999,2.02E+11,220,7,,,,,,,,,,,,,,,,,39,14,,30.09,,,,,,,,
Ulaanbaatar_ HourlyPM25_201510.CSV,Ulaanbaatar,2/5/2018 12:00,10/21/2015 11:00,2015,10,21,11,2.02E+11,0.063,mg/mÂ³,155,1 Hr,442920,99999,2.02E+11,160,9,,,,,,,,,,,,,,,,,34,14,,30.06,,,,,,,,
Ulaanbaatar_ HourlyPM25_201510.CSV,Ulaanbaatar,2/5/2018 12:00,10/21/2015 12:00,2015,10,21,12,2.02E+11,0.056,mg/mÂ³,151,1 Hr,442920,99999,2.02E+11,,,,,,,,,31.2,,,,,,,,,,38,16,1024.2,30.09,,48,,,,,0,
Ulaanbaatar_ HourlyPM25_201510.CSV,Ulaanbaatar,2/5/2018 12:00,10/21/2015 13:00,2015,10,21,13,2.02E+11,0.054,mg/mÂ³,147,1 Hr,442920,99999,2.02E+11,170,4,,,,,,,,,,,,,,,,,25,14,,30.09,,,,,,,,
Ulaanbaatar_ HourlyPM25_201510.CSV,Ulaanbaatar,2/5/2018 12:00,10/21/2015 14:00,2015,10,21,14,2.02E+11,0.051,mg/mÂ³,139,1 Hr,442920,99999,2.02E+11,160,7,,,,,,,,,,,,,,,,,27,16,,30.09,,,,,,,,
Ulaanbaatar_ HourlyPM25_201510.CSV,Ulaanbaatar,2/5/2018 12:00,10/21/2015 15:00,2015,10,21,15,2.02E+11,0.02,mg/mÂ³,68,1 Hr,442920,99999,2.02E+11,,,,,,,,,31.2,,,,,,,,,,21,14,1027.9,30.12,,,,,,,,
Ulaanbaatar_ HourlyPM25_201510.CSV,Ulaanbaatar,2/5/2018 12:00,10/21/2015 16:00,2015,10,21,16,2.02E+11,0.016,mg/mÂ³,59,1 Hr,442920,99999,2.02E+11,990,2,,,,,,,,,,,,,,,,,23,14,,30.12,,,,,,,,
Ulaanbaatar_ HourlyPM25_201510.CSV,Ulaanbaatar,2/5/2018 12:00,10/21/2015 17:00,2015,10,21,17,2.02E+11,0.011,mg/mÂ³,46,1 Hr,442920,99999,2.02E+11,990,2,,,,,,,,,,,,,,,,,21,14,,30.12,,,,,,,,
Ulaanbaatar_ HourlyPM25_201510.CSV,Ulaanbaatar,2/5/2018 12:00,10/21/2015 18:00,2015,10,21,18,2.02E+11,0.016,mg/mÂ³,59,1 Hr,442920,99999,2.02E+11,,,,,,,,,31.2,,,,,,,,,,26,10,1028.7,30.09,,,,,,,,
Ulaanbaatar_ HourlyPM25_201510.CSV,Ulaanbaatar,2/5/2018 12:00,10/21/2015 19:00,2015,10,21,19,2.02E+11,0.033,mg/mÂ³,95,1 Hr,442920,99999,2.02E+11,,0,,,,,,,,,,,,,,,,,16,10,,30.09,,,,,,,,
Ulaanbaatar_ HourlyPM25_201510.CSV,Ulaanbaatar,2/5/2018 12:00,10/21/2015 20:00,2015,10,21,20,2.02E+11,0.174,mg/mÂ³,224,1 Hr,442920,99999,2.02E+11,170,4,,,,,,,,,,,,,,,,,16,12,,30.09,,,,,,,,
Ulaanbaatar_ HourlyPM25_201510.CSV,Ulaanbaatar,2/5/2018 12:00,10/21/2015 21:00,2015,10,21,21,2.02E+11,0.105,mg/mÂ³,177,1 Hr,442920,99999,2.02E+11,,,,,,,,,31.2,,,,,,,,,,16,12,1022.7,30.06,,,,,,,,
Ulaanbaatar_ HourlyPM25_201510.CSV,Ulaanbaatar,2/5/2018 12:00,10/21/2015 22:00,2015,10,21,22,2.02E+11,0.121,mg/mÂ³,185,1 Hr,442920,99999,2.02E+11,990,2,,,,,,,,,,,,,,,,,14,9,,30.06,,,,,,,,
Ulaanbaatar_ HourlyPM25_201510.CSV,Ulaanbaatar,2/5/2018 12:00,10/21/2015 23:00,2015,10,21,23,2.02E+11,0.083,mg/mÂ³,165,1 Hr,442920,99999,2.02E+11,,0,,,,,,,,,,,,,,,,,12,9,,30.06,,,,,,,,
Ulaanbaatar_ HourlyPM25_201510.CSV,Ulaanbaatar,2/5/2018 12:00,10/22/2015 0:00,2015,10,22,0,2.02E+11,0.104,mg/mÂ³,176,1 Hr,442920,99999,2.02E+11,,,,,,,,,6.2,4,,,,,,,,0,26,10,1027.5,30.06,,,24,,,,,
Ulaanbaatar_ HourlyPM25_201510.CSV,Ulaanbaatar,2/5/2018 12:00,10/22/2015 1:00,2015,10,22,1,2.02E+11,0,mg/mÂ³,26,1 Hr,442920,99999,2.02E+11,,0,,,,,,,,,,,,,,,,,23,16,,30.06,,,,,,,,
Ulaanbaatar_ HourlyPM25_201510.CSV,Ulaanbaatar,2/5/2018 12:00,10/22/2015 2:00,2015,10,22,2,2.02E+11,0.07,mg/mÂ³,158,1 Hr,442920,99999,2.02E+11,990,2,,722,CLR,,,,5,,,,,,,,,,28,18,,30.06,,,,,,,,
Ulaanbaatar_ HourlyPM25_201510.CSV,Ulaanbaatar,2/5/2018 12:00,10/22/2015 3:00,2015,10,22,3,2.02E+11,0.061,mg/mÂ³,154,1 Hr,442920,99999,2.02E+11,,,,722,CLR,,,,1.2,4,,,,,,,,0,36,18,1022.4,30.06,,,,,,,,
Ulaanbaatar_ HourlyPM25_201510.CSV,Ulaanbaatar,2/5/2018 12:00,10/22/2015 4:00,2015,10,22,4,2.02E+11,0.055,mg/mÂ³,149,1 Hr,442920,99999,2.02E+11,,0,,722,CLR,,,,5,,,,,,,,,,43,18,,30.03,,,,,,,,
Ulaanbaatar_ HourlyPM25_201510.CSV,Ulaanbaatar,2/5/2018 12:00,10/22/2015 5:00,2015,10,22,5,2.02E+11,0.043,mg/mÂ³,119,1 Hr,442920,99999,2.02E+11,990,2,,250,,,,,5,,,,,,,,,,46,16,,30,,,,,,,,
Ulaanbaatar_ HourlyPM25_201510.CSV,Ulaanbaatar,2/5/2018 12:00,10/22/2015 6:00,2015,10,22,6,2.02E+11,0.043,mg/mÂ³,119,1 Hr,442920,99999,2.02E+11,990,2,,,SCT,,,,2.5,4,,,,,,,,0,52,14,1016,29.97,,,,,,,,
Ulaanbaatar_ HourlyPM25_201510.CSV,Ulaanbaatar,2/5/2018 12:00,10/22/2015 7:00,2015,10,22,7,2.02E+11,0.05,mg/mÂ³,137,1 Hr,442920,99999,2.02E+11,990,7,,,,,,,,,,,,,,,,,52,14,,29.94,,,,,,,,
Ulaanbaatar_ HourlyPM25_201510.CSV,Ulaanbaatar,2/5/2018 12:00,10/22/2015 8:00,2015,10,22,8,2.02E+11,0.094,mg/mÂ³,171,1 Hr,442920,99999,2.02E+11,250,9,,,,,,,,,,,,,,,,,54,10,,29.94,,,,,,,,
Ulaanbaatar_ HourlyPM25_201510.CSV,Ulaanbaatar,2/5/2018 12:00,10/22/2015 9:00,2015,10,22,9,2.02E+11,0.27,mg/mÂ³,317,1 Hr,442920,99999,2.02E+11,220,4,,,,,,,6.2,4,,,,,,,,0,52,10,1014.4,29.91,,,,,,,,
Ulaanbaatar_ HourlyPM25_201510.CSV,Ulaanbaatar,2/5/2018 12:00,10/22/2015 10:00,2015,10,22,10,2.02E+11,0.209,mg/mÂ³,259,1 Hr,442920,99999,2.02E+11,220,9,,,,,,,,,,,,,,,,,45,10,,29.91,,,,,,,,
Ulaanbaatar_ HourlyPM25_201510.CSV,Ulaanbaatar,2/5/2018 12:00,10/22/2015 11:00,2015,10,22,11,2.02E+11,0.04,mg/mÂ³,112,1 Hr,442920,99999,2.02E+11,160,4,,,,,,,,,,,,,,,,,36,9,,29.94,,,,,,,,
Ulaanbaatar_ HourlyPM25_201510.CSV,Ulaanbaatar,2/5/2018 12:00,10/22/2015 12:00,2015,10,22,12,2.02E+11,0.032,mg/mÂ³,93,1 Hr,442920,99999,2.02E+11,,,,,,,,,31.2,,,,,,,,,,32,12,1018.9,29.94,,54,,,,,,
Ulaanbaatar_ HourlyPM25_201510.CSV,Ulaanbaatar,2/5/2018 12:00,10/22/2015 13:00,2015,10,22,13,2.02E+11,0.038,mg/mÂ³,107,1 Hr,442920,99999,2.02E+11,,0,,,,,,,,,,,,,,,,,32,10,,29.94,,,,,,,,
Ulaanbaatar_ HourlyPM25_201510.CSV,Ulaanbaatar,2/5/2018 12:00,10/22/2015 14:00,2015,10,22,14,2.02E+11,0.051,mg/mÂ³,139,1 Hr,442920,99999,2.02E+11,990,2,,,,,,,,,,,,,,,,,30,12,,29.97,,,,,,,,
Ulaanbaatar_ HourlyPM25_201510.CSV,Ulaanbaatar,2/5/2018 12:00,10/22/2015 15:00,2015,10,22,15,2.02E+11,0.028,mg/mÂ³,84,1 Hr,442920,99999,2.02E+11,,,,,,,,,31.2,,,,,,,,,,25,12,1022.3,29.97,,,,,,,,
Ulaanbaatar_ HourlyPM25_201510.CSV,Ulaanbaatar,2/5/2018 12:00,10/22/2015 16:00,2015,10,22,16,2.02E+11,0.017,mg/mÂ³,61,1 Hr,442920,99999,2.02E+11,990,2,,,,,,,,,,,,,,,,,21,9,,29.97,,,,,,,,
Ulaanbaatar_ HourlyPM25_201510.CSV,Ulaanbaatar,2/5/2018 12:00,10/22/2015 17:00,2015,10,22,17,2.02E+11,0.995,mg/mÂ³,996,1 Hr,442920,99999,2.02E+11,990,2,,,,,,,,,,,,,,,,,21,10,,29.97,,,,,,,,
Ulaanbaatar_ HourlyPM25_201510.CSV,Ulaanbaatar,2/5/2018 12:00,10/22/2015 18:00,2015,10,22,18,2.02E+11,0.016,mg/mÂ³,59,1 Hr,442920,99999,2.02E+11,,,,,,,,,31.2,,,,,,,,,,29,12,1023.7,29.97,,,,,,,,
Ulaanbaatar_ HourlyPM25_201510.CSV,Ulaanbaatar,2/5/2018 12:00,10/22/2015 19:00,2015,10,22,19,2.02E+11,0.027,mg/mÂ³,82,1 Hr,442920,99999,2.02E+11,990,2,,,,,,,,,,,,,,,,,18,9,,30,,,,,,,,
Ulaanbaatar_ HourlyPM25_201510.CSV,Ulaanbaatar,2/5/2018 12:00,10/22/2015 20:00,2015,10,22,20,2.02E+11,0.263,mg/mÂ³,311,1 Hr,442920,99999,2.02E+11,990,2,,,,,,,,,,,,,,,,,18,9,,29.97,,,,,,,,
Ulaanbaatar_ HourlyPM25_201510.CSV,Ulaanbaatar,2/5/2018 12:00,10/22/2015 21:00,2015,10,22,21,2.02E+11,0.084,mg/mÂ³,166,1 Hr,442920,99999,2.02E+11,,,,,,,,,31.2,,,,,,,,,,16,9,1024.6,30,,,,,,,,
Ulaanbaatar_ HourlyPM25_201510.CSV,Ulaanbaatar,2/5/2018 12:00,10/22/2015 22:00,2015,10,22,22,2.02E+11,0.072,mg/mÂ³,160,1 Hr,442920,99999,2.02E+11,990,2,,,,,,,,,,,,,,,,,18,10,,30.03,,,,,,,,
Ulaanbaatar_ HourlyPM25_201510.CSV,Ulaanbaatar,2/5/2018 12:00,10/22/2015 23:00,2015,10,22,23,2.02E+11,0.073,mg/mÂ³,160,1 Hr,442920,99999,2.02E+11,990,2,,,,,,,,,,,,,,,,,16,10,,30.03,,,,,,,,
Ulaanbaatar_ HourlyPM25_201510.CSV,Ulaanbaatar,2/5/2018 12:00,10/23/2015 2:00,2015,10,23,2,2.02E+11,0.071,mg/mÂ³,159,1 Hr,442920,99999,2.02E+11,,0,,250,,,,,5,,,,,,,,,,30,16,,30.09,,,,,,,,
Ulaanbaatar_ HourlyPM25_201510.CSV,Ulaanbaatar,2/5/2018 12:00,10/23/2015 3:00,2015,10,23,3,2.02E+11,0.098,mg/mÂ³,173,1 Hr,442920,99999,2.02E+11,990,2,,250,,,,,5,4,,,,,,,,2,37,16,1026,30.12,,,,,,,,
Ulaanbaatar_ HourlyPM25_201510.CSV,Ulaanbaatar,2/5/2018 12:00,10/23/2015 4:00,2015,10,23,4,2.02E+11,0.071,mg/mÂ³,159,1 Hr,442920,99999,2.02E+11,990,2,,250,,,,,5,,,,,,,,,,43,14,,30.12,,,,,,,,
Ulaanbaatar_ HourlyPM25_201510.CSV,Ulaanbaatar,2/5/2018 12:00,10/23/2015 5:00,2015,10,23,5,2.02E+11,0.043,mg/mÂ³,119,1 Hr,442920,99999,2.02E+11,990,4,,250,,,,,6.2,,,,,,,,,,48,16,,30.09,,,,,,,,
Ulaanbaatar_ HourlyPM25_201510.CSV,Ulaanbaatar,2/5/2018 12:00,10/23/2015 6:00,2015,10,23,6,2.02E+11,0.059,mg/mÂ³,153,1 Hr,442920,99999,2.02E+11,290,7,,250,BKN,,,,6.2,4,,,,,,,,2,50,15,1021.5,,871.7,,,,,,,
Ulaanbaatar_ HourlyPM25_201510.CSV,Ulaanbaatar,2/5/2018 12:00,10/23/2015 7:00,2015,10,23,7,2.02E+11,0.114,mg/mÂ³,181,1 Hr,442920,99999,2.02E+11,330,11,,250,,,,,6.2,,,,,,,,,,50,14,,30.09,,,,,,,,
Ulaanbaatar_ HourlyPM25_201510.CSV,Ulaanbaatar,2/5/2018 12:00,10/23/2015 8:00,2015,10,23,8,2.02E+11,0.154,mg/mÂ³,204,1 Hr,442920,99999,2.02E+11,340,13,,250,,,,,6.2,,,,,,,,,,50,14,,30.09,,,,,,,,
Ulaanbaatar_ HourlyPM25_201510.CSV,Ulaanbaatar,2/5/2018 12:00,10/23/2015 9:00,2015,10,23,9,2.02E+11,0.235,mg/mÂ³,285,1 Hr,442920,99999,2.02E+11,320,2,,250,,,,,6.2,,,,,,,,,,46,16,1022.2,30.12,,,,,,,,
Ulaanbaatar_ HourlyPM25_201510.CSV,Ulaanbaatar,2/5/2018 12:00,10/23/2015 10:00,2015,10,23,10,2.02E+11,0.163,mg/mÂ³,213,1 Hr,442920,99999,2.02E+11,320,7,,250,,,,,6.2,,,,,,,,,,39,16,,30.12,,,,,,,,
Ulaanbaatar_ HourlyPM25_201510.CSV,Ulaanbaatar,2/5/2018 12:00,10/23/2015 11:00,2015,10,23,11,2.02E+11,0.091,mg/mÂ³,169,1 Hr,442920,99999,2.02E+11,990,4,,,,,,,,,,,,,,,,,34,14,,30.15,,,,,,,,
Ulaanbaatar_ HourlyPM25_201510.CSV,Ulaanbaatar,2/5/2018 12:00,10/23/2015 12:00,2015,10,23,12,2.02E+11,0.06,mg/mÂ³,153,1 Hr,442920,99999,2.02E+11,180,4,,,,,,,31.2,,,,,,,,,,28,18,1028.5,30.18,,51,,,,,,
Ulaanbaatar_ HourlyPM25_201510.CSV,Ulaanbaatar,2/5/2018 12:00,10/23/2015 13:00,2015,10,23,13,2.02E+11,0.069,mg/mÂ³,158,1 Hr,442920,99999,2.02E+11,130,4,,,,,,,,,,,,,,,,,27,14,,30.18,,,,,,,,
Ulaanbaatar_ HourlyPM25_201510.CSV,Ulaanbaatar,2/5/2018 12:00,10/23/2015 14:00,2015,10,23,14,2.02E+11,0.057,mg/mÂ³,152,1 Hr,442920,99999,2.02E+11,990,2,,,,,,,,,,,,,,,,,28,14,,30.18,,,,,,,,
Ulaanbaatar_ HourlyPM25_201510.CSV,Ulaanbaatar,2/5/2018 12:00,10/23/2015 15:00,2015,10,23,15,2.02E+11,0.04,mg/mÂ³,112,1 Hr,442920,99999,2.02E+11,,0,,,,,,,31.2,,,,,,,,,,34,19,1031,,875.2,,,,,,,
Ulaanbaatar_ HourlyPM25_201510.CSV,Ulaanbaatar,2/5/2018 12:00,10/23/2015 16:00,2015,10,23,16,2.02E+11,0.018,mg/mÂ³,63,1 Hr,442920,99999,2.02E+11,,0,,,,,,,,,,,,,,,,,23,14,,30.21,,,,,,,,
Ulaanbaatar_ HourlyPM25_201510.CSV,Ulaanbaatar,2/5/2018 12:00,10/23/2015 17:00,2015,10,23,17,2.02E+11,0.017,mg/mÂ³,61,1 Hr,442920,99999,2.02E+11,990,2,,,,,,,,,,,,,,,,,23,12,,30.21,,,,,,,,
Ulaanbaatar_ HourlyPM25_201510.CSV,Ulaanbaatar,2/5/2018 12:00,10/23/2015 18:00,2015,10,23,18,2.02E+11,0.042,mg/mÂ³,117,1 Hr,442920,99999,2.02E+11,,,,,SCT,,,,31.2,,,,,,,,,,23,16,1032.4,30.21,,,,,,,,
Ulaanbaatar_ HourlyPM25_201510.CSV,Ulaanbaatar,2/5/2018 12:00,10/23/2015 19:00,2015,10,23,19,2.02E+11,0.065,mg/mÂ³,156,1 Hr,442920,99999,2.02E+11,990,4,,,,,,,,,,,,,,,,,25,16,,30.21,,,,,,,,
Ulaanbaatar_ HourlyPM25_201510.CSV,Ulaanbaatar,2/5/2018 12:00,10/23/2015 20:00,2015,10,23,20,2.02E+11,0.119,mg/mÂ³,184,1 Hr,442920,99999,2.02E+11,990,4,,,,,,,,,,,,,,,,,28,18,,30.24,,,,,,,,
Ulaanbaatar_ HourlyPM25_201510.CSV,Ulaanbaatar,2/5/2018 12:00,10/23/2015 21:00,2015,10,23,21,2.02E+11,0.087,mg/mÂ³,167,1 Hr,442920,99999,2.02E+11,,,,,,,,,31.2,,,,,,,,,,30,18,1030.9,30.21,,,,,,,,
Ulaanbaatar_ HourlyPM25_201510.CSV,Ulaanbaatar,2/5/2018 12:00,10/23/2015 22:00,2015,10,23,22,2.02E+11,0.119,mg/mÂ³,184,1 H,442920,99999,2.02E+11,990,4,,,,,,,,,,,,,,,,,30,18,,30.21,,,,,,,,
Ulaanbaatar_ HourlyPM25_201510.CSV,Ulaanbaatar,2/5/2018 12:00,10/24/2015 11:00,2015,10,24,11,2.02E+11,0.018,mg/mÂ³,63,1 Hr,442920,99999,2.02E+11,140,27,,100,,,,,6.2,,,,,,,,,,46,14,,30.09,,,,,,,,
Ulaanbaatar_ HourlyPM25_201510.CSV,Ulaanbaatar,2/5/2018 12:00,10/24/2015 12:00,2015,10,24,12,2.02E+11,0.021,mg/mÂ³,70,1 Hr,442920,99999,2.02E+11,70,9,,100,,,,,6.2,,,,,,,,,,46,14,1022.6,30.12,,54,,,,,,
Ulaanbaatar_ HourlyPM25_201510.CSV,Ulaanbaatar,2/5/2018 12:00,10/24/2015 13:00,2015,10,24,13,2.02E+11,0.015,mg/mÂ³,57,1 Hr,442920,99999,2.02E+11,140,25,36,100,,,,,6.2,,,,,,,,,,45,14,,30.12,,,,,,,,
Ulaanbaatar_ HourlyPM25_201510.CSV,Ulaanbaatar,2/5/2018 12:00,10/24/2015 14:00,2015,10,24,14,2.02E+11,0.008,mg/mÂ³,33,1 Hr,442920,99999,2.02E+11,140,20,,100,,,,,6.2,,,,,,,,,,45,14,,30.12,,,,,,,,
Ulaanbaatar_ HourlyPM25_201510.CSV,Ulaanbaatar,2/5/2018 12:00,10/24/2015 15:00,2015,10,24,15,2.02E+11,0.009,mg/mÂ³,38,1 Hr,442920,99999,2.02E+11,30,9,,,,,,,6.2,,,,,,,,,,45,14,1024.2,30.12,,,,,,,,
Ulaanbaatar_ HourlyPM25_201510.CSV,Ulaanbaatar,2/5/2018 12:00,10/24/2015 16:00,2015,10,24,16,2.02E+11,0.011,mg/mÂ³,46,1 Hr,442920,99999,2.02E+11,140,20,,,,,,,6.2,,,,,,,,,,45,14,,30.12,,,,,,,,
Ulaanbaatar_ HourlyPM25_201510.CSV,Ulaanbaatar,2/5/2018 12:00,10/24/2015 17:00,2015,10,24,17,2.02E+11,0.012,mg/mÂ³,50,1 Hr,442920,99999,2.02E+11,990,9,,,,,,,6.2,,,,,,,,,,43,14,,30.12,,,,,,,,
Ulaanbaatar_ HourlyPM25_201510.CSV,Ulaanbaatar,2/5/2018 12:00,10/24/2015 18:00,2015,10,24,18,2.02E+11,0.015,mg/mÂ³,57,1 Hr,442920,99999,2.02E+11,40,7,,,,,,,6.2,,,,,,,,,,43,14,1023.7,30.09,,,,,,,,
Ulaanbaatar_ HourlyPM25_201510.CSV,Ulaanbaatar,2/5/2018 12:00,10/24/2015 19:00,2015,10,24,19,2.02E+11,0.012,mg/mÂ³,50,1 Hr,442920,99999,2.02E+11,150,11,,,,,,,6.2,,,,,,,,,,43,14,,30.09,,,,,,,,
Ulaanbaatar_ HourlyPM25_201510.CSV,Ulaanbaatar,2/5/2018 12:00,10/24/2015 20:00,2015,10,24,20,2.02E+11,0.014,mg/mÂ³,55,1 Hr,442920,99999,2.02E+11,140,9,,100,,,,,6.2,,,,,,,,,,41,16,,30.06,,,,,,,,
Ulaanbaatar_ HourlyPM25_201510.CSV,Ulaanbaatar,2/5/2018 12:00,10/24/2015 21:00,2015,10,24,21,2.02E+11,0.018,mg/mÂ³,63,1 Hr,442920,99999,2.02E+11,40,7,,100,SCT,,,,31.2,,,,,,,,,,40,16,1021.7,,870.1,,,,,,,
Ulaanbaatar_ HourlyPM25_201510.CSV,Ulaanbaatar,2/5/2018 12:00,10/24/2015 22:00,2015,10,24,22,2.02E+11,0.017,mg/mÂ³,61,1 Hr,442920,99999,2.02E+11,990,7,,100,,,,,6.2,,,,,,,,,,41,18,,30,,,,,,,,
Ulaanbaatar_ HourlyPM25_201510.CSV,Ulaanbaatar,2/5/2018 12:00,10/24/2015 23:00,2015,10,24,23,2.02E+11,0.015,mg/mÂ³,57,1 Hr,442920,99999,2.02E+11,990,4,,100,,,,,6.2,,,,,,,,,,41,18,,30,,,,,,,,
Ulaanbaatar_ HourlyPM25_201510.CSV,Ulaanbaatar,2/5/2018 12:00,10/25/2015 2:00,2015,10,25,2,2.02E+11,0.015,mg/mÂ³,57,1 Hr,442920,99999,2.02E+11,160,16,,100,,,,,6.2,,,,,,,,,,45,16,,29.94,,,,,,,,
Ulaanbaatar_ HourlyPM25_201510.CSV,Ulaanbaatar,2/5/2018 12:00,10/25/2015 3:00,2015,10,25,3,2.02E+11,0.018,mg/mÂ³,63,1 Hr,442920,99999,2.02E+11,150,20,,80,,,,,6.2,61,,,,,,,,2,45,18,1016.1,29.88,,,,,,,,
Ulaanbaatar_ HourlyPM25_201510.CSV,Ulaanbaatar,2/5/2018 12:00,10/25/2015 4:00,2015,10,25,4,2.02E+11,0.015,mg/mÂ³,57,1 Hr,442920,99999,2.02E+11,990,11,,80,,,,,6.2,63,,,,,,,,,39,25,,29.91,,,,,,,,
Ulaanbaatar_ HourlyPM25_201510.CSV,Ulaanbaatar,2/5/2018 12:00,10/25/2015 5:00,2015,10,25,5,2.02E+11,0.013,mg/mÂ³,53,1 Hr,442920,99999,2.02E+11,200,18,,33,,,,,6.2,61,,,,,,,,,43,30,,29.85,,,,,,,,
Ulaanbaatar_ HourlyPM25_201510.CSV,Ulaanbaatar,2/5/2018 12:00,10/25/2015 6:00,2015,10,25,6,2.02E+11,0.016,mg/mÂ³,59,1 Hr,442920,99999,2.02E+11,990,9,,33,OVC,,,,1.2,61,,,,,,,,7,39,35,1013.8,,863.2,,,,,,,
Ulaanbaatar_ HourlyPM25_201510.CSV,Ulaanbaatar,2/5/2018 12:00,10/25/2015 7:00,2015,10,25,7,2.02E+11,0.014,mg/mÂ³,55,1 Hr,442920,99999,2.02E+11,190,13,,33,,,,,3.8,63,,,,,,,,,39,34,,29.77,,,,,,,,
Ulaanbaatar_ HourlyPM25_201510.CSV,Ulaanbaatar,2/5/2018 12:00,10/25/2015 8:00,2015,10,25,8,2.02E+11,0.012,mg/mÂ³,50,1 Hr,442920,99999,2.02E+11,220,11,,33,,,,,3.8,63,,,,,,,,,37,34,,29.74,,,,,,,,
Ulaanbaatar_ HourlyPM25_201510.CSV,Ulaanbaatar,2/5/2018 12:00,10/25/2015 9:00,2015,10,25,9,2.02E+11,0.022,mg/mÂ³,72,1 Hr,442920,99999,2.02E+11,320,9,,30,,,,,0.3,73,,,,,,,,7,30,28,1015.8,29.77,,,,,,,,
Ulaanbaatar_ HourlyPM25_201510.CSV,Ulaanbaatar,2/5/2018 12:00,10/25/2015 10:00,2015,10,25,10,2.02E+11,0.027,mg/mÂ³,82,1 Hr,442920,99999,2.02E+11,320,11,,30,,,,,0.8,73,,,,,,,,,28,27,,29.8,,,,,,,,
Ulaanbaatar_ HourlyPM25_201510.CSV,Ulaanbaatar,2/5/2018 12:00,10/25/2015 11:00,2015,10,25,11,2.02E+11,0.027,mg/mÂ³,82,1 Hr,442920,99999,2.02E+11,340,13,,30,,,,,6.2,,,,,,,,,,27,23,,29.8,,,,,,,,
Ulaanbaatar_ HourlyPM25_201510.CSV,Ulaanbaatar,2/5/2018 12:00,10/25/2015 12:00,2015,10,25,12,2.02E+11,0.021,mg/mÂ³,70,1 Hr,442920,99999,2.02E+11,360,4,,33,BKN,,,,6.2,22,,,,,,,,7,26,22,1019.1,29.83,,45,,,,,0.31,
Ulaanbaatar_ HourlyPM25_201510.CSV,Ulaanbaatar,2/5/2018 12:00,10/25/2015 13:00,2015,10,25,13,2.02E+11,0.044,mg/mÂ³,122,1 Hr,442920,99999,2.02E+11,990,11,,33,,,,,6.2,,,,,,,,,,23,19,,29.85,,,,,,,,
Ulaanbaatar_ HourlyPM25_201510.CSV,Ulaanbaatar,2/5/2018 12:00,10/25/2015 14:00,2015,10,25,14,2.02E+11,0.033,mg/mÂ³,95,1 Hr,442920,99999,2.02E+11,330,20,,30,,,,,6.2,71,38,,,,,,,,23,19,,29.85,,,,,,,,
Ulaanbaatar_ HourlyPM25_201510.CSV,Ulaanbaatar,2/5/2018 12:00,10/25/2015 15:00,2015,10,25,15,2.02E+11,0.076,mg/mÂ³,162,1 Hr,442920,99999,2.02E+11,320,4,,30,,,,,5,71,,,,,,,,7,23,18,1022.3,,865.5,,,,,,,
Ulaanbaatar_ HourlyPM25_201510.CSV,Ulaanbaatar,2/5/2018 12:00,10/25/2015 16:00,2015,10,25,16,2.02E+11,0.058,mg/mÂ³,152,1 Hr,442920,99999,2.02E+11,330,22,,30,,,,,1.9,73,38,,,,,,,,21,18,,29.88,,,,,,,,
Ulaanbaatar_ HourlyPM25_201510.CSV,Ulaanbaatar,2/5/2018 12:00,10/25/2015 17:00,2015,10,25,17,2.02E+11,0.156,mg/mÂ³,206,1 Hr,442920,99999,2.02E+11,330,22,,30,,,,,3.1,71,38,,,,,,,,21,18,,29.88,,,,,,,,
Ulaanbaatar_ HourlyPM25_201510.CSV,Ulaanbaatar,2/5/2018 12:00,10/25/2015 18:00,2015,10,25,18,2.02E+11,0.029,mg/mÂ³,87,1 Hr,442920,99999,2.02E+11,330,22,,30,OVC,,,,2.5,73,71,,,,,,,7,21,18,1024.1,,866.5,,,,,,,
Ulaanbaatar_ HourlyPM25_201510.CSV,Ulaanbaatar,2/5/2018 12:00,10/25/2015 19:00,2015,10,25,19,2.02E+11,0.026,mg/mÂ³,80,1 Hr,442920,99999,2.02E+11,330,20,,30,,,,,3.8,71,38,,,,,,,,21,16,,29.94,,,,,,,,
Ulaanbaatar_ HourlyPM25_201510.CSV,Ulaanbaatar,2/5/2018 12:00,10/25/2015 20:00,2015,10,25,20,2.02E+11,0.017,mg/mÂ³,61,1 Hr,442920,99999,2.02E+11,330,22,,33,,,,,6.2,,,,,,,,,,21,14,,29.97,,,,,,,,
Ulaanbaatar_ HourlyPM25_201510.CSV,Ulaanbaatar,2/5/2018 12:00,10/25/2015 21:00,2015,10,25,21,2.02E+11,0.015,mg/mÂ³,57,1 Hr,442920,99999,2.02E+11,340,18,,33,,,,,6.2,73,,,,,,,,7,21,15,1027.2,30,,,,,,,,
Ulaanbaatar_ HourlyPM25_201510.CSV,Ulaanbaatar,2/5/2018 12:00,10/25/2015 22:00,2015,10,25,22,2.02E+11,0.015,mg/mÂ³,57,1 Hr,442920,99999,2.02E+11,340,18,,,,,,,6.2,,,,,,,,,,19,14,,30,,,,,,,,
Ulaanbaatar_ HourlyPM25_201510.CSV,Ulaanbaatar,2/5/2018 12:00,10/25/2015 23:00,2015,10,25,23,2.02E+11,0.016,mg/mÂ³,59,1 Hr,442920,99999,2.02E+11,330,18,,,,,,,6.2,,,,,,,,,,18,12,,30.03,,,,,,,,
Ulaanbaatar_ HourlyPM25_201510.CSV,Ulaanbaatar,2/5/2018 12:00,10/26/2015 2:00,2015,10,26,2,2.02E+11,0.014,mg/mÂ³,55,1 Hr,442920,99999,2.02E+11,340,7,,,,,,,6.2,,,,,,,,,,21,12,,30.09,,,,,,,,
Ulaanbaatar_ HourlyPM25_201510.CSV,Ulaanbaatar,2/5/2018 12:00,10/26/2015 3:00,2015,10,26,3,2.02E+11,0.013,mg/mÂ³,53,1 Hr,442920,99999,2.02E+11,50,4,,,,,,,6.2,,,,,,,,,,21,12,1028.8,30.09,,,,,,,,
Ulaanbaatar_ HourlyPM25_201510.CSV,Ulaanbaatar,2/5/2018 12:00,10/26/2015 4:00,2015,10,26,4,2.02E+11,0.014,mg/mÂ³,55,1 Hr,442920,99999,2.02E+11,330,9,,,,,,,6.2,,,,,,,,,,23,12,,30.09,,,,,,,,
Ulaanbaatar_ HourlyPM25_201510.CSV,Ulaanbaatar,2/5/2018 12:00,10/26/2015 5:00,2015,10,26,5,2.02E+11,0.015,mg/mÂ³,57,1 Hr,442920,99999,2.02E+11,990,7,,,,,,,6.2,,,,,,,,,,25,12,,30.06,,,,,,,,
Ulaanbaatar_ HourlyPM25_201510.CSV,Ulaanbaatar,2/5/2018 12:00,10/26/2015 6:00,2015,10,26,6,2.02E+11,0.016,mg/mÂ³,59,1 Hr,442920,99999,2.02E+11,990,7,,,SCT,,,,6.2,,,,,,,,,,25,13,1027.3,30.06,,,,,,,,
Ulaanbaatar_ HourlyPM25_201510.CSV,Ulaanbaatar,2/5/2018 12:00,10/26/2015 7:00,2015,10,26,7,2.02E+11,0.015,mg/mÂ³,57,1 Hr,442920,99999,2.02E+11,280,9,,100,,,,,6.2,,,,,,,,,,23,14,,30.03,,,,,,,,
Ulaanbaatar_ HourlyPM25_201510.CSV,Ulaanbaatar,2/5/2018 12:00,10/26/2015 8:00,2015,10,26,8,2.02E+11,0.018,mg/mÂ³,63,1 Hr,442920,99999,2.02E+11,290,9,,100,,,,,6.2,,,,,,,,,,23,16,,30.03,,,,,,,,
Ulaanbaatar_ HourlyPM25_201510.CSV,Ulaanbaatar,2/5/2018 12:00,10/26/2015 9:00,2015,10,26,9,2.02E+11,0.024,mg/mÂ³,76,1 Hr,442920,99999,2.02E+11,240,4,,100,,,,,6.2,,,,,,,,,,25,14,1025.1,30,,,,,,,,
Ulaanbaatar_ HourlyPM25_201510.CSV,Ulaanbaatar,2/5/2018 12:00,10/26/2015 10:00,2015,10,26,10,2.02E+11,0.024,mg/mÂ³,76,1 Hr,442920,99999,2.02E+11,330,4,,,,,,,6.2,,,,,,,,,,21,14,,30,,,,,,,,
Ulaanbaatar_ HourlyPM25_201510.CSV,Ulaanbaatar,2/5/2018 12:00,10/26/2015 11:00,2015,10,26,11,2.02E+11,0.021,mg/mÂ³,70,1 Hr,442920,99999,2.02E+11,160,4,,,,,,,6.2,,,,,,,,,,14,10,,30,,,,,,,,
Ulaanbaatar_ HourlyPM25_201510.CSV,Ulaanbaatar,2/5/2018 12:00,10/26/2015 12:00,2015,10,26,12,2.02E+11,0.022,mg/mÂ³,72,1 Hr,442920,99999,2.02E+11,990,2,,100,,,,,6.2,,,,,,,,,,18,14,1026.6,30,,27,,,,,,
Ulaanbaatar_ HourlyPM25_201510.CSV,Ulaanbaatar,2/5/2018 12:00,10/26/2015 13:00,2015,10,26,13,2.02E+11,0.018,mg/mÂ³,63,1 Hr,442920,99999,2.02E+11,170,4,,100,,,,,6.2,,,,,,,,,,14,10,,30,,,,,,,,
Ulaanbaatar_ HourlyPM25_201510.CSV,Ulaanbaatar,2/5/2018 12:00,10/26/2015 14:00,2015,10,26,14,2.02E+11,0.016,mg/mÂ³,59,1 Hr,442920,99999,2.02E+11,170,4,,100,,,,,6.2,,,,,,,,,,18,12,,29.97,,,,,,,,
Ulaanbaatar_ HourlyPM25_201510.CSV,Ulaanbaatar,2/5/2018 12:00,10/26/2015 15:00,2015,10,26,15,2.02E+11,0.016,mg/mÂ³,59,1 Hr,442920,99999,2.02E+11,180,7,,100,BKN,,,,6.2,,,,,,,,,,21,15,1026.3,,868.5,,,,,,,
Ulaanbaatar_ HourlyPM25_201510.CSV,Ulaanbaatar,2/5/2018 12:00,10/26/2015 16:00,2015,10,26,16,2.02E+11,0.018,mg/mÂ³,63,1 Hr,442920,99999,2.02E+11,990,2,,100,,,,,6.2,,,,,,,,,,18,14,,30,,,,,,,,
Ulaanbaatar_ HourlyPM25_201510.CSV,Ulaanbaatar,2/5/2018 12:00,10/26/2015 17:00,2015,10,26,17,2.02E+11,0.025,mg/mÂ³,78,1 Hr,442920,99999,2.02E+11,,0,,80,,,,,6.2,71,,,,,,,,,19,14,,30,,,,,,,,
Ulaanbaatar_ HourlyPM25_201510.CSV,Ulaanbaatar,2/5/2018 12:00,10/26/2015 18:00,2015,10,26,18,2.02E+11,0.034,mg/mÂ³,97,1 Hr,442920,99999,2.02E+11,,,,100,,,,,6.2,,,,,,,,,,20,12,1027.1,30,,,,,,,,
Ulaanbaatar_ HourlyPM25_201510.CSV,Ulaanbaatar,2/5/2018 12:00,10/26/2015 19:00,2015,10,26,19,2.02E+11,0.038,mg/mÂ³,107,1 Hr,442920,99999,2.02E+11,,0,,100,,,,,6.2,,,,,,,,,,16,12,,30,,,,,,,,
Ulaanbaatar_ HourlyPM25_201510.CSV,Ulaanbaatar,2/5/2018 12:00,10/26/2015 20:00,2015,10,26,20,2.02E+11,0.048,mg/mÂ³,132,1 Hr,442920,99999,2.02E+11,990,2,,,,,,,6.2,,,,,,,,,,7,5,,30,,,,,,,,
Ulaanbaatar_ HourlyPM25_201510.CSV,Ulaanbaatar,2/5/2018 12:00,10/26/2015 21:00,2015,10,26,21,2.02E+11,0.049,mg/mÂ³,134,1 Hr,442920,99999,2.02E+11,,,,,SCT,,,,31.2,,,,,,,,,,9,7,1028.3,30,,,,,,,,
Ulaanbaatar_ HourlyPM25_201510.CSV,Ulaanbaatar,2/5/2018 12:00,10/26/2015 22:00,2015,10,26,22,2.02E+11,0.071,mg/mÂ³,159,1 Hr,442920,99999,2.02E+11,,0,,,,,,,,,,,,,,,,,9,5,,30,,,,,,,,
Ulaanbaatar_ HourlyPM25_201510.CSV,Ulaanbaatar,2/5/2018 12:00,10/26/2015 23:00,2015,10,26,23,2.02E+11,0.107,mg/mÂ³,178,1 Hr,442920,99999,2.02E+11,990,2,,,,,,,6.2,,,,,,,,,,12,10,,30.03,,,,,,,,
Ulaanbaatar_ HourlyPM25_201510.CSV,Ulaanbaatar,2/5/2018 12:00,10/27/2015 2:00,2015,10,27,2,2.02E+11,0.067,mg/mÂ³,157,1 Hr,442920,99999,2.02E+11,990,4,,33,,,,,6.2,,,,,,,,,,21,16,,30.06,,,,,,,,
Ulaanbaatar_ HourlyPM25_201510.CSV,Ulaanbaatar,2/5/2018 12:00,10/27/2015 3:00,2015,10,27,3,2.02E+11,0.026,mg/mÂ³,80,1 Hr,442920,99999,2.02E+11,250,11,,33,,,,,6.2,22,,,,,,,,7,21,16,1028.6,30.06,,,,,,,,
Ulaanbaatar_ HourlyPM25_201510.CSV,Ulaanbaatar,2/5/2018 12:00,10/27/2015 4:00,2015,10,27,4,2.02E+11,0.022,mg/mÂ³,72,1 Hr,442920,99999,2.02E+11,990,2,,33,,,,,6.2,,,,,,,,,,23,16,,30.06,,,,,,,,
Ulaanbaatar_ HourlyPM25_201510.CSV,Ulaanbaatar,2/5/2018 12:00,10/27/2015 5:00,2015,10,27,5,2.02E+11,0.019,mg/mÂ³,66,1 Hr,442920,99999,2.02E+11,310,9,,,,,,,6.2,,,,,,,,,,25,16,,30.06,,,,,,,,
Ulaanbaatar_ HourlyPM25_201510.CSV,Ulaanbaatar,2/5/2018 12:00,10/27/2015 6:00,2015,10,27,6,2.02E+11,0.02,mg/mÂ³,68,1 Hr,442920,99999,2.02E+11,300,11,,,BKN,,,,6.2,2,,,,,,,,7,29,16,1026.3,,870.7,,,,,,,
Ulaanbaatar_ HourlyPM25_201510.CSV,Ulaanbaatar,2/5/2018 12:00,10/27/2015 7:00,2015,10,27,7,2.02E+11,0.029,mg/mÂ³,87,1 Hr,442920,99999,2.02E+11,300,13,,,,,,,6.2,,,,,,,,,,27,18,,30.06,,,,,,,,
Ulaanbaatar_ HourlyPM25_201510.CSV,Ulaanbaatar,2/5/2018 12:00,10/27/2015 8:00,2015,10,27,8,2.02E+11,0.03,mg/mÂ³,89,1 Hr,442920,99999,2.02E+11,990,13,,,,,,,6.2,,,,,,,,,,27,16,,30.06,,,,,,,,
Ulaanbaatar_ HourlyPM25_201510.CSV,Ulaanbaatar,2/5/2018 12:00,10/27/2015 9:00,2015,10,27,9,2.02E+11,0.037,mg/mÂ³,105,1 Hr,442920,99999,2.02E+11,990,9,,,,,,,6.2,,,,,,,,,,25,14,1028.6,30.09,,,,,,,,
Ulaanbaatar_ HourlyPM25_201510.CSV,Ulaanbaatar,2/5/2018 12:00,10/27/2015 10:00,2015,10,27,10,2.02E+11,0.037,mg/mÂ³,105,1 Hr,442920,99999,2.02E+11,330,9,,100,,,,,6.2,,,,,,,,,,21,14,,30.09,,,,,,,,
Ulaanbaatar_ HourlyPM25_201510.CSV,Ulaanbaatar,2/5/2018 12:00,10/27/2015 11:00,2015,10,27,11,2.02E+11,0.023,mg/mÂ³,74,1 Hr,442920,99999,2.02E+11,340,9,,100,,,,,6.2,,,,,,,,,,21,12,,30.12,,,,,,,,
Ulaanbaatar_ HourlyPM25_201510.CSV,Ulaanbaatar,2/5/2018 12:00,10/27/2015 12:00,2015,10,27,12,2.02E+11,0.03,mg/mÂ³,89,1 Hr,442920,99999,2.02E+11,,,,100,,,,,6.2,,,,,,,,,,18,13,1032.2,30.15,,29,,,,,0,T
Ulaanbaatar_ HourlyPM25_201510.CSV,Ulaanbaatar,2/5/2018 12:00,10/27/2015 13:00,2015,10,27,13,2.02E+11,0.025,mg/mÂ³,78,1 Hr,442920,99999,2.02E+11,350,4,,,,,,,6.2,,,,,,,,,,19,14,,30.15,,,,,,,,
Ulaanbaatar_ HourlyPM25_201510.CSV,Ulaanbaatar,2/5/2018 12:00,10/27/2015 14:00,2015,10,27,14,2.02E+11,0.02,mg/mÂ³,68,1 Hr,442920,99999,2.02E+11,280,4,,,,,,,6.2,,,,,,,,,,14,10,,30.18,,,,,,,,
Ulaanbaatar_ HourlyPM25_201510.CSV,Ulaanbaatar,2/5/2018 12:00,10/27/2015 15:00,2015,10,27,15,2.02E+11,0.016,mg/mÂ³,59,1 Hr,442920,99999,2.02E+11,,,,,,,,,6.2,71,,,,,,,,7,20,12,1034.1,30.21,,,,,,,,
Ulaanbaatar_ HourlyPM25_201510.CSV,Ulaanbaatar,2/5/2018 12:00,10/27/2015 16:00,2015,10,27,16,2.02E+11,0.016,mg/mÂ³,59,1 Hr,442920,99999,2.02E+11,,0,,,,,,,6.2,,,,,,,,,,10,7,,30.21,,,,,,,,
Ulaanbaatar_ HourlyPM25_201510.CSV,Ulaanbaatar,2/5/2018 12:00,10/27/2015 17:00,2015,10,27,17,2.02E+11,0.019,mg/mÂ³,66,1 Hr,442920,99999,2.02E+11,,0,,,,,,,6.2,,,,,,,,,,14,9,,30.24,,,,,,,,
Ulaanbaatar_ HourlyPM25_201510.CSV,Ulaanbaatar,2/5/2018 12:00,10/27/2015 18:00,2015,10,27,18,2.02E+11,0.028,mg/mÂ³,84,1 Hr,442920,99999,2.02E+11,310,2,,,,,,,6.2,70,,,,,,,,7,19,10,1035.9,30.24,,,,,,,,
Ulaanbaatar_ HourlyPM25_201510.CSV,Ulaanbaatar,2/5/2018 12:00,10/27/2015 19:00,2015,10,27,19,2.02E+11,0.039,mg/mÂ³,110,1 Hr,442920,99999,2.02E+11,320,4,,,,,,,6.2,,,,,,,,,,12,9,,30.24,,,,,,,,
Ulaanbaatar_ HourlyPM25_201510.CSV,Ulaanbaatar,2/5/2018 12:00,10/27/2015 20:00,2015,10,27,20,2.02E+11,0.051,mg/mÂ³,139,1 Hr,442920,99999,2.02E+11,990,2,,,,,,,6.2,,,,,,,,,,10,7,,30.27,,,,,,,,
Ulaanbaatar_ HourlyPM25_201510.CSV,Ulaanbaatar,2/5/2018 12:00,10/27/2015 21:00,2015,10,27,21,2.02E+11,0.062,mg/mÂ³,154,1 Hr,442920,99999,2.02E+11,290,7,,,,,,,31.2,2,,,,,,,,7,17,10,1037.9,,876.9,,,,,,,
Ulaanbaatar_ HourlyPM25_201510.CSV,Ulaanbaatar,2/5/2018 12:00,10/27/2015 22:00,2015,10,27,22,2.02E+11,0.058,mg/mÂ³,152,1 Hr,442920,99999,2.02E+11,270,7,,,,,,,6.2,,,,,,,,,,14,9,,30.3,,,,,,,,
Ulaanbaatar_ HourlyPM25_201510.CSV,Ulaanbaatar,2/5/2018 12:00,10/27/2015 23:00,2015,10,27,23,2.02E+11,0.065,mg/mÂ³,156,1 Hr,442920,99999,2.02E+11,990,4,,100,,,,,6.2,,,,,,,,,,16,10,,30.3,,,,,,,,
Ulaanbaatar_ HourlyPM25_201510.CSV,Ulaanbaatar,2/5/2018 12:00,10/28/2015 0:00,2015,10,28,0,2.02E+11,0.037,mg/mÂ³,105,1 Hr,442920,99999,2.02E+11,,,,100,,,,,6.2,71,,,,,,,,7,18,12,1039,30.33,,,17,,,,0,T 1
Ulaanbaatar_ HourlyPM25_201510.CSV,Ulaanbaatar,2/5/2018 12:00,10/28/2015 1:00,2015,10,28,1,2.02E+11,0.023,mg/mÂ³,74,1 Hr,442920,99999,2.02E+11,340,9,,33,,,,,6.2,,,,,,,,,,18,10,,30.36,,,,,,,,
Ulaanbaatar_ HourlyPM25_201510.CSV,Ulaanbaatar,2/5/2018 12:00,10/28/2015 2:00,2015,10,28,2,2.02E+11,0.024,mg/mÂ³,76,1 Hr,442920,99999,2.02E+11,350,9,,,,,,,6.2,,,,,,,,,,19,10,,30.36,,,,,,,,
Ulaanbaatar_ HourlyPM25_201510.CSV,Ulaanbaatar,2/5/2018 12:00,10/28/2015 3:00,2015,10,28,3,2.02E+11,0.027,mg/mÂ³,82,1 Hr,442920,99999,2.02E+11,310,9,,33,BKN,,,,6.2,70,,,,,,,,7,20,12,1039.6,,879.5,,,,,,,
Ulaanbaatar_ HourlyPM25_201510.CSV,Ulaanbaatar,2/5/2018 12:00,10/28/2015 4:00,2015,10,28,4,2.02E+11,0.022,mg/mÂ³,72,1 Hr,442920,99999,2.02E+11,330,11,,30,,,,,6.2,71,,,,,,,,,19,12,,30.36,,,,,,,,
Ulaanbaatar_ HourlyPM25_201510.CSV,Ulaanbaatar,2/5/2018 12:00,10/28/2015 5:00,2015,10,28,5,2.02E+11,0.02,mg/mÂ³,68,1 Hr,442920,99999,2.02E+11,340,13,,30,,,,,6.2,71,,,,,,,,,19,12,,30.36,,,,,,,,
Ulaanbaatar_ HourlyPM25_201510.CSV,Ulaanbaatar,2/5/2018 12:00,10/28/2015 6:00,2015,10,28,6,2.02E+11,0.017,mg/mÂ³,61,1 Hr,442920,99999,2.02E+11,290,13,,30,BKN,,,,6.2,2,,,,,,,,7,21,12,1038.8,,879.3,,,,,,,
Ulaanbaatar_ HourlyPM25_201510.CSV,Ulaanbaatar,2/5/2018 12:00,10/28/2015 7:00,2015,10,28,7,2.02E+11,0.017,mg/mÂ³,61,1 Hr,442920,99999,2.02E+11,330,7,,,,,,,6.2,,,,,,,,,,23,14,,30.36,,,,,,,,
Ulaanbaatar_ HourlyPM25_201510.CSV,Ulaanbaatar,2/5/2018 12:00,10/28/2015 8:00,2015,10,28,8,2.02E+11,0.024,mg/mÂ³,76,1 Hr,442920,99999,2.02E+11,290,16,,250,,,,,6.2,,,,,,,,,,23,12,,30.36,,,,,,,,
Ulaanbaatar_ HourlyPM25_201510.CSV,Ulaanbaatar,2/5/2018 12:00,10/28/2015 9:00,2015,10,28,9,2.02E+11,0.028,mg/mÂ³,84,1 Hr,442920,99999,2.02E+11,280,9,,100,,,,,6.2,,,,,,,,,,21,12,1038.7,30.36,,,,,,,,
Ulaanbaatar_ HourlyPM25_201510.CSV,Ulaanbaatar,2/5/2018 12:00,10/28/2015 10:00,2015,10,28,10,2.02E+11,0.028,mg/mÂ³,84,1 Hr,442920,99999,2.02E+11,330,9,,100,,,,,6.2,,,,,,,,,,21,10,,30.36,,,,,,,,
Ulaanbaatar_ HourlyPM25_201510.CSV,Ulaanbaatar,2/5/2018 12:00,10/28/2015 11:00,2015,10,28,11,2.02E+11,0.024,mg/mÂ³,76,1 Hr,442920,99999,2.02E+11,330,4,,,,,,,6.2,,,,,,,,,,19,10,,30.39,,,,,,,,
Ulaanbaatar_ HourlyPM25_201510.CSV,Ulaanbaatar,2/5/2018 12:00,10/28/2015 12:00,2015,10,28,12,2.02E+11,0.024,mg/mÂ³,76,1 Hr,442920,99999,2.02E+11,,0,,,BKN,,,,6.2,,,,,,,,,,18,9,1040.7,30.39,,25,,,,,0,T
Ulaanbaatar_ HourlyPM25_201510.CSV,Ulaanbaatar,2/5/2018 12:00,10/28/2015 13:00,2015,10,28,13,2.02E+11,0.02,mg/mÂ³,68,1 Hr,442920,99999,2.02E+11,990,4,,100,,,,,6.2,,,,,,,,,,18,9,,30.39,,,,,,,,
Ulaanbaatar_ HourlyPM25_201510.CSV,Ulaanbaatar,2/5/2018 12:00,10/28/2015 14:00,2015,10,28,14,2.02E+11,0.02,mg/mÂ³,68,1 Hr,442920,99999,2.02E+11,990,4,,100,,,,,6.2,,,,,,,,,,19,7,,30.39,,,,,,,,
Ulaanbaatar_ HourlyPM25_201510.CSV,Ulaanbaatar,2/5/2018 12:00,10/28/2015 15:00,2015,10,28,15,2.02E+11,0.017,mg/mÂ³,61,1 Hr,442920,99999,2.02E+11,990,4,,100,,,,,6.2,,,,,,,,,,19,9,1040.4,30.39,,,,,,,,
Ulaanbaatar_ HourlyPM25_201510.CSV,Ulaanbaatar,2/5/2018 12:00,10/28/2015 16:00,2015,10,28,16,2.02E+11,0.019,mg/mÂ³,66,1 Hr,442920,99999,2.02E+11,990,2,,100,,,,,6.2,,,,,,,,,,21,9,,30.39,,,,,,,,
Ulaanbaatar_ HourlyPM25_201510.CSV,Ulaanbaatar,2/5/2018 12:00,10/28/2015 17:00,2015,10,28,17,2.02E+11,0.017,mg/mÂ³,61,1 Hr,442920,99999,2.02E+11,990,2,,,,,,,6.2,,,,,,,,,,18,9,,30.39,,,,,,,,
Ulaanbaatar_ HourlyPM25_201510.CSV,Ulaanbaatar,2/5/2018 12:00,10/28/2015 18:00,2015,10,28,18,2.02E+11,0.029,mg/mÂ³,87,1 Hr,442920,99999,2.02E+11,990,2,,100,,,,,6.2,,,,,,,,,,19,10,1040.9,30.42,,,,,,,,
Ulaanbaatar_ HourlyPM25_201510.CSV,Ulaanbaatar,2/5/2018 12:00,10/28/2015 19:00,2015,10,28,19,2.02E+11,0.034,mg/mÂ³,97,1 Hr,442920,99999,2.02E+11,990,2,,100,,,,,6.2,,,,,,,,,,19,12,,30.42,,,,,,,,
Ulaanbaatar_ HourlyPM25_201510.CSV,Ulaanbaatar,2/5/2018 12:00,10/28/2015 20:00,2015,10,28,20,2.02E+11,0.047,mg/mÂ³,129,1 Hr,442920,99999,2.02E+11,990,2,,100,,,,,6.2,,,,,,,,,,18,12,,30.42,,,,,,,,
Ulaanbaatar_ HourlyPM25_201510.CSV,Ulaanbaatar,2/5/2018 12:00,10/28/2015 21:00,2015,10,28,21,2.02E+11,0.025,mg/mÂ³,78,1 Hr,442920,99999,2.02E+11,990,2,,,,,,,6.2,,,,,,,,,,14,11,1041.3,30.42,,,,,,,,
Ulaanbaatar_ HourlyPM25_201510.CSV,Ulaanbaatar,2/5/2018 12:00,10/28/2015 22:00,2015,10,28,22,2.02E+11,0.026,mg/mÂ³,80,1 Hr,442920,99999,2.02E+11,990,2,,,,,,,,,,,,,,,,,12,5,,30.42,,,,,,,,
Ulaanbaatar_ HourlyPM25_201510.CSV,Ulaanbaatar,2/5/2018 12:00,10/28/2015 23:00,2015,10,28,23,2.02E+11,0.027,mg/mÂ³,82,1 Hr,442920,99999,2.02E+11,990,2,,,,,,,,,,,,,,,,,18,9,,30.42,,,,,,,,
Ulaanbaatar_ HourlyPM25_201510.CSV,Ulaanbaatar,2/5/2018 12:00,10/29/2015 0:00,2015,10,29,0,2.02E+11,0.028,mg/mÂ³,84,1 Hr,442920,99999,2.02E+11,,,,,SCT,,,,12.5,4,,,,,,,,0,18,9,1042.2,30.42,,,17,,,,,1
Ulaanbaatar_ HourlyPM25_201510.CSV,Ulaanbaatar,2/5/2018 12:00,10/29/2015 1:00,2015,10,29,1,2.02E+11,0.026,mg/mÂ³,80,1 Hr,442920,99999,2.02E+11,990,2,,,,,,,,,,,,,,,,,18,9,,30.45,,,,,,,,
Ulaanbaatar_ HourlyPM25_201510.CSV,Ulaanbaatar,2/5/2018 12:00,10/29/2015 2:00,2015,10,29,2,2.02E+11,0.018,mg/mÂ³,63,1 Hr,442920,99999,2.02E+11,300,7,,,,,,,,,,,,,,,,,21,10,,30.45,,,,,,,,
Ulaanbaatar_ HourlyPM25_201510.CSV,Ulaanbaatar,2/5/2018 12:00,10/29/2015 3:00,2015,10,29,3,2.02E+11,0.031,mg/mÂ³,91,1 Hr,442920,99999,2.02E+11,240,9,,,SCT,,,,12.5,4,,,,,,,,0,23,12,1041.2,30.47,,,,,,,,
Ulaanbaatar_ HourlyPM25_201510.CSV,Ulaanbaatar,2/5/2018 12:00,10/29/2015 4:00,2015,10,29,4,2.02E+11,0.018,mg/mÂ³,63,1 Hr,442920,99999,2.02E+11,300,9,,,,,,,,,,,,,,,,,25,12,,30.47,,,,,,,,
Ulaanbaatar_ HourlyPM25_201510.CSV,Ulaanbaatar,2/5/2018 12:00,10/29/2015 5:00,2015,10,29,5,2.02E+11,0.016,mg/mÂ³,59,1 Hr,442920,99999,2.02E+11,280,7,,,,,,,,,,,,,,,,,27,16,,30.47,,,,,,,,
Ulaanbaatar_ HourlyPM25_201510.CSV,Ulaanbaatar,2/5/2018 12:00,10/29/2015 6:00,2015,10,29,6,2.02E+11,0.017,mg/mÂ³,61,1 Hr,442920,99999,2.02E+11,330,7,,,SCT,,,,31.2,,,,,,,,,,32,10,1038.5,,882.1,,,,,,,
Ulaanbaatar_ HourlyPM25_201510.CSV,Ulaanbaatar,2/5/2018 12:00,10/29/2015 7:00,2015,10,29,7,2.02E+11,0.086,mg/mÂ³,167,1 Hr,442920,99999,2.02E+11,990,11,,,,,,,,,,,,,,,,,32,18,,30.45,,,,,,,,
Ulaanbaatar_ HourlyPM25_201510.CSV,Ulaanbaatar,2/5/2018 12:00,10/29/2015 8:00,2015,10,29,8,2.02E+11,0.086,mg/mÂ³,167,1 Hr,442920,99999,2.02E+11,990,7,,,,,,,,,,,,,,,,,30,18,,30.47,,,,,,,,
Ulaanbaatar_ HourlyPM25_201510.CSV,Ulaanbaatar,2/5/2018 12:00,10/29/2015 9:00,2015,10,29,9,2.02E+11,0.069,mg/mÂ³,158,1 Hr,442920,99999,2.02E+11,290,7,,,SCT,,,,31.2,,,,,,,,,,28,8,1039.5,,882.5,,,,,,,
Ulaanbaatar_ HourlyPM25_201510.CSV,Ulaanbaatar,2/5/2018 12:00,10/29/2015 10:00,2015,10,29,10,2.02E+11,0.102,mg/mÂ³,175,1 Hr,442920,99999,2.02E+11,240,7,,,,,,,,,,,,,,,,,23,16,,30.47,,,,,,,,
Ulaanbaatar_ HourlyPM25_201510.CSV,Ulaanbaatar,2/5/2018 12:00,10/29/2015 11:00,2015,10,29,11,2.02E+11,0.073,mg/mÂ³,160,1 Hr,442920,99999,2.02E+11,990,2,,,,,,,,,,,,,,,,,19,12,,30.47,,,,,,,,
Ulaanbaatar_ HourlyPM25_201510.CSV,Ulaanbaatar,2/5/2018 12:00,10/29/2015 12:00,2015,10,29,12,2.02E+11,0.057,mg/mÂ³,152,1 Hr,442920,99999,2.02E+11,,,,,,,,,31.2,,,,,,,,,,18,12,1042.5,30.47,,33,,,,,,
Ulaanbaatar_ HourlyPM25_201510.CSV,Ulaanbaatar,2/5/2018 12:00,10/29/2015 13:00,2015,10,29,13,2.02E+11,0.067,mg/mÂ³,157,1 Hr,442920,99999,2.02E+11,150,7,,,,,,,,,,,,,,,,,14,10,,30.47,,,,,,,,
Ulaanbaatar_ HourlyPM25_201510.CSV,Ulaanbaatar,2/5/2018 12:00,10/29/2015 14:00,2015,10,29,14,2.02E+11,0.055,mg/mÂ³,149,1 Hr,442920,99999,2.02E+11,990,4,,,,,,,,,,,,,,,,,14,9,,30.47,,,,,,,,
Ulaanbaatar_ HourlyPM25_201510.CSV,Ulaanbaatar,2/5/2018 12:00,10/29/2015 15:00,2015,10,29,15,2.02E+11,0.059,mg/mÂ³,153,1 Hr,442920,99999,2.02E+11,,,,,,,,,31.2,,,,,,,,,,14,9,1043.3,30.47,,,,,,,,
Ulaanbaatar_ HourlyPM25_201510.CSV,Ulaanbaatar,2/5/2018 12:00,10/29/2015 16:00,2015,10,29,16,2.02E+11,0.061,mg/mÂ³,154,1 Hr,442920,99999,2.02E+11,170,4,,,,,,,,,,,,,,,,,12,7,,30.47,,,,,,,,
Ulaanbaatar_ HourlyPM25_201510.CSV,Ulaanbaatar,2/5/2018 12:00,10/29/2015 17:00,2015,10,29,17,2.02E+11,0.062,mg/mÂ³,154,1 Hr,442920,99999,2.02E+11,,0,,,,,,,,,,,,,,,,,12,7,,30.47,,,,,,,,
Ulaanbaatar_ HourlyPM25_201510.CSV,Ulaanbaatar,2/5/2018 12:00,10/29/2015 18:00,2015,10,29,18,2.02E+11,0.081,mg/mÂ³,164,1 Hr,442920,99999,2.02E+11,,,,,BKN,,,,,,,,,,,,,,20,7,1043.3,30.47,,,,,,,,
Ulaanbaatar_ HourlyPM25_201510.CSV,Ulaanbaatar,2/5/2018 12:00,10/29/2015 19:00,2015,10,29,19,2.02E+11,0.1,mg/mÂ³,174,1 Hr,442920,99999,2.02E+11,160,4,,,,,,,,,,,,,,,,,14,9,,30.45,,,,,,,,
Ulaanbaatar_ HourlyPM25_201510.CSV,Ulaanbaatar,2/5/2018 12:00,10/29/2015 20:00,2015,10,29,20,2.02E+11,0.078,mg/mÂ³,163,1 Hr,442920,99999,2.02E+11,990,2,,,,,,,,,,,,,,,,,16,9,,30.45,,,,,,,,
Ulaanbaatar_ HourlyPM25_201510.CSV,Ulaanbaatar,2/5/2018 12:00,10/29/2015 21:00,2015,10,29,21,2.02E+11,0.082,mg/mÂ³,165,1 Hr,442920,99999,2.02E+11,990,2,,,SCT,,,,31.2,,,,,,,,,,12,12,1042.8,30.45,,,,,,,,
Ulaanbaatar_ HourlyPM25_201510.CSV,Ulaanbaatar,2/5/2018 12:00,10/29/2015 22:00,2015,10,29,22,2.02E+11,0.231,mg/mÂ³,281,1 Hr,442920,99999,2.02E+11,990,2,,,,,,,,,,,,,,,,,12,7,,30.45,,,,,,,,
Ulaanbaatar_ HourlyPM25_201510.CSV,Ulaanbaatar,2/5/2018 12:00,10/29/2015 23:00,2015,10,29,23,2.02E+11,0.205,mg/mÂ³,255,1 Hr,442920,99999,2.02E+11,990,2,,,,,,,,,,,,,,,,,7,3,,30.47,,,,,,,,
Ulaanbaatar_ HourlyPM25_201510.CSV,Ulaanbaatar,2/5/2018 12:00,10/30/2015 0:00,2015,10,30,0,2.02E+11,0.13,mg/mÂ³,189,1 Hr,442920,99999,2.02E+11,,,,,SCT,,,,6.2,4,,,,,,,,0,9,5,1044.4,30.47,,,,,,,,
Ulaanbaatar_ HourlyPM25_201510.CSV,Ulaanbaatar,2/5/2018 12:00,10/30/2015 1:00,2015,10,30,1,2.02E+11,0.125,mg/mÂ³,187,1 Hr,442920,99999,2.02E+11,,0,,,,,,,,,,,,,,,,,16,10,,30.47,,,,,,,,
Ulaanbaatar_ HourlyPM25_201510.CSV,Ulaanbaatar,2/5/2018 12:00,10/30/2015 2:00,2015,10,30,2,2.02E+11,0.095,mg/mÂ³,171,1 Hr,442920,99999,2.02E+11,990,2,,,,,,,,,,,,,,,,,19,12,,30.5,,,,,,,,
Ulaanbaatar_ HourlyPM25_201510.CSV,Ulaanbaatar,2/5/2018 12:00,10/30/2015 3:00,2015,10,30,3,2.02E+11,0.107,mg/mÂ³,178,1 Hr,442920,99999,2.02E+11,990,2,,,,,,,6.2,4,,,,,,,,0,28,14,1041,,883,,,,,,,
Ulaanbaatar_ HourlyPM25_201510.CSV,Ulaanbaatar,2/5/2018 12:00,10/30/2015 4:00,2015,10,30,4,2.02E+11,0.078,mg/mÂ³,163,1 Hr,442920,99999,2.02E+11,,0,,,,,,,,,,,,,,,,,28,18,,30.47,,,,,,,,
Ulaanbaatar_ HourlyPM25_201510.CSV,Ulaanbaatar,2/5/2018 12:00,10/30/2015 5:00,2015,10,30,5,2.02E+11,0.074,mg/mÂ³,161,1 Hr,442920,99999,2.02E+11,990,2,,,,,,,,,,,,,,,,,32,16,,30.47,,,,,,,,
Ulaanbaatar_ HourlyPM25_201510.CSV,Ulaanbaatar,2/5/2018 12:00,10/30/2015 6:00,2015,10,30,6,2.02E+11,0.078,mg/mÂ³,163,1 Hr,442920,99999,2.02E+11,220,7,,,,,,,31.2,,,,,,,,,,32,16,1037.9,30.47,,,,,,,,
Ulaanbaatar_ HourlyPM25_201510.CSV,Ulaanbaatar,2/5/2018 12:00,10/30/2015 7:00,2015,10,30,7,2.02E+11,,mg/mÂ³,,1 Hr,442920,99999,2.02E+11,260,4,,,,,,,,,,,,,,,,,34,14,,30.45,,,,,,,,
Ulaanbaatar_ HourlyPM25_201510.CSV,Ulaanbaatar,2/5/2018 12:00,10/30/2015 8:00,2015,10,30,8,2.02E+11,,mg/mÂ³,,1 Hr,442920,99999,2.02E+11,230,4,,,,,,,,,,,,,,,,,34,16,,30.45,,,,,,,,
Ulaanbaatar_ HourlyPM25_201510.CSV,Ulaanbaatar,2/5/2018 12:00,10/30/2015 9:00,2015,10,30,9,2.02E+11,0.183,mg/mÂ³,233,1 Hr,442920,99999,2.02E+11,170,4,,,,,,,31.2,,,,,,,,,,32,17,1037.9,,882.1,,,,,,,
Ulaanbaatar_ HourlyPM25_201510.CSV,Ulaanbaatar,2/5/2018 12:00,10/30/2015 10:00,2015,10,30,10,2.02E+11,0.189,mg/mÂ³,239,1 Hr,442920,99999,2.02E+11,170,7,,,,,,,,,,,,,,,,,23,18,,30.45,,,,,,,,
Ulaanbaatar_ HourlyPM25_201510.CSV,Ulaanbaatar,2/5/2018 12:00,10/30/2015 11:00,2015,10,30,11,2.02E+11,0.123,mg/mÂ³,186,1 Hr,442920,99999,2.02E+11,190,7,,,,,,,,,,,,,,,,,25,16,,30.47,,,,,,,,
Ulaanbaatar_ HourlyPM25_201510.CSV,Ulaanbaatar,2/5/2018 12:00,10/30/2015 12:00,2015,10,30,12,2.02E+11,0.076,mg/mÂ³,162,1 Hr,442920,99999,2.02E+11,990,2,,,,,,,31.2,,,,,,,,,,21,17,1040,,882.4,36,,,,,,
Ulaanbaatar_ HourlyPM25_201510.CSV,Ulaanbaatar,2/5/2018 12:00,10/30/2015 13:00,2015,10,30,13,2.02E+11,0.084,mg/mÂ³,166,1 Hr,442920,99999,2.02E+11,990,2,,,,,,,,,,,,,,,,,19,14,,30.45,,,,,,,,
Ulaanbaatar_ HourlyPM25_201510.CSV,Ulaanbaatar,2/5/2018 12:00,10/30/2015 14:00,2015,10,30,14,2.02E+11,0.063,mg/mÂ³,155,1 Hr,442920,99999,2.02E+11,160,4,,,,,,,,,,,,,,,,,18,12,,30.45,,,,,,,,
Ulaanbaatar_ HourlyPM25_201510.CSV,Ulaanbaatar,2/5/2018 12:00,10/30/2015 15:00,2015,10,30,15,2.02E+11,0.06,mg/mÂ³,153,1 Hr,442920,99999,2.02E+11,,,,,,,,,31.2,,,,,,,,,,23,17,1041.6,,882,,,,,,,
Ulaanbaatar_ HourlyPM25_201510.CSV,Ulaanbaatar,2/5/2018 12:00,10/30/2015 16:00,2015,10,30,16,2.02E+11,0.059,mg/mÂ³,153,1 Hr,442920,99999,2.02E+11,990,2,,,,,,,,,,,,,,,,,14,9,,30.45,,,,,,,,
Ulaanbaatar_ HourlyPM25_201510.CSV,Ulaanbaatar,2/5/2018 12:00,10/30/2015 17:00,2015,10,30,17,2.02E+11,0.061,mg/mÂ³,154,1 Hr,442920,99999,2.02E+11,990,2,,,,,,,,,,,,,,,,,10,7,,30.42,,,,,,,,
Ulaanbaatar_ HourlyPM25_201510.CSV,Ulaanbaatar,2/5/2018 12:00,10/30/2015 18:00,2015,10,30,18,2.02E+11,0.081,mg/mÂ³,164,1 Hr,442920,99999,2.02E+11,990,2,,,,,,,31.2,,,,,,,,,,21,14,1041.6,,881.2,,,,,,,
Ulaanbaatar_ HourlyPM25_201510.CSV,Ulaanbaatar,2/5/2018 12:00,10/30/2015 19:00,2015,10,30,19,2.02E+11,0.121,mg/mÂ³,185,1 Hr,442920,99999,2.02E+11,120,4,,,,,,,,,,,,,,,,,12,7,,30.42,,,,,,,,
Ulaanbaatar_ HourlyPM25_201510.CSV,Ulaanbaatar,2/5/2018 12:00,10/30/2015 20:00,2015,10,30,20,2.02E+11,,mg/mÂ³,,1 Hr,442920,99999,2.02E+11,990,2,,,,,,,,,,,,,,,,,10,7,,30.39,,,,,,,,
Ulaanbaatar_ HourlyPM25_201510.CSV,Ulaanbaatar,2/5/2018 12:00,10/30/2015 21:00,2015,10,30,21,2.02E+11,,mg/mÂ³,,1 Hr,442920,99999,2.02E+11,80,2,,,,,,,31.2,,,,,,,,,,9,7,1039.9,30.36,,,,,,,,
Ulaanbaatar_ HourlyPM25_201510.CSV,Ulaanbaatar,2/5/2018 12:00,10/30/2015 22:00,2015,10,30,22,2.02E+11,,mg/mÂ³,,1 Hr,442920,99999,2.02E+11,990,2,,,,,,,,,,,,,,,,,9,5,,30.36,,,,,,,,
Ulaanbaatar_ HourlyPM25_201510.CSV,Ulaanbaatar,2/5/2018 12:00,10/30/2015 23:00,2015,10,30,23,2.02E+11,,mg/mÂ³,,1 Hr,442920,99999,2.02E+11,990,2,,,,,,,,,,,,,,,,,7,3,,30.33,,,,,,,,
Ulaanbaatar_ HourlyPM25_201510.CSV,Ulaanbaatar,2/5/2018 12:00,10/31/2015 0:00,2015,10,31,0,2.02E+11,,mg/mÂ³,,1 Hr,442920,99999,2.02E+11,80,4,,,,,,,2.5,4,,,,,,,,0,9,5,1038.9,30.33,,,,,,,,0
Ulaanbaatar_ HourlyPM25_201510.CSV,Ulaanbaatar,2/5/2018 12:00,10/31/2015 1:00,2015,10,31,1,2.02E+11,,mg/mÂ³,,1 Hr,442920,99999,2.02E+11,,0,,,,,,,,,,,,,,,,,14,9,,30.33,,,,,,,,
Ulaanbaatar_ HourlyPM25_201510.CSV,Ulaanbaatar,2/5/2018 12:00,10/31/2015 2:00,2015,10,31,2,2.02E+11,,mg/mÂ³,,1 Hr,442920,99999,2.02E+11,990,2,,722,CLR,,,,5,,,,,,,,,,19,12,,30.33,,,,,,,,
Ulaanbaatar_ HourlyPM25_201510.CSV,Ulaanbaatar,2/5/2018 12:00,10/31/2015 3:00,2015,10,31,3,2.02E+11,,mg/mÂ³,,1 Hr,442920,99999,2.02E+11,70,4,,722,CLR,,,,5,4,,,,,,,,0,23,14,1033.2,30.3,,,,,,,,
Ulaanbaatar_ HourlyPM25_201510.CSV,Ulaanbaatar,2/5/2018 12:00,10/31/2015 4:00,2015,10,31,4,2.02E+11,,mg/mÂ³,,1 Hr,442920,99999,2.02E+11,990,2,,722,CLR,,,,5,,,,,,,,,,28,16,,30.27,,,,,,,,
Ulaanbaatar_ HourlyPM25_201510.CSV,Ulaanbaatar,2/5/2018 12:00,10/31/2015 5:00,2015,10,31,5,2.02E+11,,mg/mÂ³,,1 Hr,442920,99999,2.02E+11,990,2,,722,CLR,,,,5,,,,,,,,,,32,18,,30.24,,,,,,,,
Ulaanbaatar_ HourlyPM25_201510.CSV,Ulaanbaatar,2/5/2018 12:00,10/31/2015 6:00,2015,10,31,6,2.02E+11,,mg/mÂ³,,1 Hr,442920,99999,2.02E+11,990,2,,,,,,,12.5,4,,,,,,,,0,37,14,1026.9,,874.9,,,,,,,
Ulaanbaatar_ HourlyPM25_201510.CSV,Ulaanbaatar,2/5/2018 12:00,10/31/2015 7:00,2015,10,31,7,2.02E+11,,mg/mÂ³,,1 Hr,442920,99999,2.02E+11,990,2,,,,,,,,,,,,,,,,,41,21,,30.18,,,,,,,,
Ulaanbaatar_ HourlyPM25_201510.CSV,Ulaanbaatar,2/5/2018 12:00,10/31/2015 8:00,2015,10,31,8,2.02E+11,,mg/mÂ³,,1 Hr,442920,99999,2.02E+11,180,9,,,,,,,,,,,,,,,,,43,18,,30.15,,,,,,,,
Ulaanbaatar_ HourlyPM25_201510.CSV,Ulaanbaatar,2/5/2018 12:00,10/31/2015 9:00,2015,10,31,9,2.02E+11,,mg/mÂ³,,1 Hr,442920,99999,2.02E+11,190,4,,,,,,,31.2,,,,,,,,,,39,19,1023.7,30.15,,,,,,,,
Ulaanbaatar_ HourlyPM25_201510.CSV,Ulaanbaatar,2/5/2018 12:00,10/31/2015 10:00,2015,10,31,10,2.02E+11,,mg/mÂ³,,1 Hr,442920,99999,2.02E+11,180,11,,,,,,,,,,,,,,,,,36,18,,30.12,,,,,,,,
Ulaanbaatar_ HourlyPM25_201510.CSV,Ulaanbaatar,2/5/2018 12:00,10/31/2015 11:00,2015,10,31,11,2.02E+11,,mg/mÂ³,,1 Hr,442920,99999,2.02E+11,180,11,,,,,,,,,,,,,,,,,34,16,,30.12,,,,,,,,
Ulaanbaatar_ HourlyPM25_201510.CSV,Ulaanbaatar,2/5/2018 12:00,10/31/2015 12:00,2015,10,31,12,2.02E+11,,mg/mÂ³,,1 Hr,442920,99999,2.02E+11,,,,,,,,,31.2,,,,,,,,,,34,14,1025.7,30.12,,48,,,,,,
Ulaanbaatar_ HourlyPM25_201510.CSV,Ulaanbaatar,2/5/2018 12:00,10/31/2015 13:00,2015,10,31,13,2.02E+11,,mg/mÂ³,,1 Hr,442920,99999,2.02E+11,170,9,,,,,,,,,,,,,,,,,32,16,,30.12,,,,,,,,
Ulaanbaatar_ HourlyPM25_201510.CSV,Ulaanbaatar,2/5/2018 12:00,10/31/2015 14:00,2015,10,31,14,2.02E+11,,mg/mÂ³,,1 Hr,442920,99999,2.02E+11,990,2,,,,,,,,,,,,,,,,,32,14,,30.09,,,,,,,,
Ulaanbaatar_ HourlyPM25_201510.CSV,Ulaanbaatar,2/5/2018 12:00,10/31/2015 15:00,2015,10,31,15,2.02E+11,,mg/mÂ³,,1 Hr,442920,99999,2.02E+11,,,,,,,,,31.2,,,,,,,,,,23,16,1027.9,30.09,,,,,,,,
Ulaanbaatar_ HourlyPM25_201510.CSV,Ulaanbaatar,2/5/2018 12:00,10/31/2015 16:00,2015,10,31,16,2.02E+11,,mg/mÂ³,,1 Hr,442920,99999,2.02E+11,990,2,,,,,,,,,,,,,,,,,25,18,,30.09,,,,,,,,
Ulaanbaatar_ HourlyPM25_201510.CSV,Ulaanbaatar,2/5/2018 12:00,10/31/2015 17:00,2015,10,31,17,2.02E+11,,mg/mÂ³,,1 Hr,442920,99999,2.02E+11,990,2,,,,,,,,,,,,,,,,,21,16,,30.09,,,,,,,,
Ulaanbaatar_ HourlyPM25_201510.CSV,Ulaanbaatar,2/5/2018 12:00,10/31/2015 18:00,2015,10,31,18,2.02E+11,,mg/mÂ³,,1 Hr,442920,99999,2.02E+11,,0,,,,,,,31.2,,,,,,,,,,27,17,1027.5,,871.3,,,,,,,
Ulaanbaatar_ HourlyPM25_201510.CSV,Ulaanbaatar,2/5/2018 12:00,10/31/2015 19:00,2015,10,31,19,2.02E+11,,mg/mÂ³,,1 Hr,442920,99999,2.02E+11,990,2,,,,,,,,,,,,,,,,,19,14,,30.06,,,,,,,,
Ulaanbaatar_ HourlyPM25_201510.CSV,Ulaanbaatar,2/5/2018 12:00,10/31/2015 20:00,2015,10,31,20,2.02E+11,,mg/mÂ³,,1 Hr,442920,99999,2.02E+11,180,4,,,,,,,,,,,,,,,,,18,14,,30.06,,,,,,,,
Ulaanbaatar_ HourlyPM25_201510.CSV,Ulaanbaatar,2/5/2018 12:00,10/31/2015 21:00,2015,10,31,21,2.02E+11,,mg/mÂ³,,1 Hr,442920,99999,2.02E+11,,,,,SCT,,,,31.2,,,,,,,,,,18,12,1028.7,30.06,,,,,,,,
Ulaanbaatar_ HourlyPM25_201510.CSV,Ulaanbaatar,2/5/2018 12:00,10/31/2015 22:00,2015,10,31,22,2.02E+11,,mg/mÂ³,,1 Hr,442920,99999,2.02E+11,990,2,,,,,,,,,,,,,,,,,19,14,,30.09,,,,,,,,
Ulaanbaatar_ HourlyPM25_201510.CSV,Ulaanbaatar,2/5/2018 12:00,10/31/2015 23:00,2015,10,31,23,2.02E+11,,mg/mÂ³,,1 Hr,442920,99999,2.02E+11,990,2,,,,,,,,,,,,,,,,,19,14,,30.09,,,,,,,,
Ulaanbaatar_ HourlyPM25_201511.CSV,Ulaanbaatar,2/5/2018 12:00,11/1/2015 0:00,2015,11,1,0,2.02E+11,,mg/mÂ³,,1 Hr,442920,99999,2.02E+11,990,2,,,BKN,,,,5,4,,,,,,,,2,23,16,1030.4,,872.3,,22,,,,,
Ulaanbaatar_ HourlyPM25_201511.CSV,Ulaanbaatar,2/5/2018 12:00,11/1/2015 1:00,2015,11,1,1,2.02E+11,,mg/mÂ³,,1 Hr,442920,99999,2.02E+11,,0,,250,,,,,5,,,,,,,,,,19,14,,30.12,,,,,,,,
Ulaanbaatar_ HourlyPM25_201511.CSV,Ulaanbaatar,2/5/2018 12:00,11/1/2015 2:00,2015,11,1,2,2.02E+11,,mg/mÂ³,,1 Hr,442920,99999,2.02E+11,990,2,,250,,,,,5,,,,,,,,,,25,18,,30.12,,,,,,,,
Ulaanbaatar_ HourlyPM25_201511.CSV,Ulaanbaatar,2/5/2018 12:00,11/1/2015 3:00,2015,11,1,3,2.02E+11,,mg/mÂ³,,1 Hr,442920,99999,2.02E+11,110,2,,722,CLR,,,,2.5,4,,,,,,,,1,33,18,1026.9,30.12,,,,,,,,
Ulaanbaatar_ HourlyPM25_201511.CSV,Ulaanbaatar,2/5/2018 12:00,11/1/2015 4:00,2015,11,1,4,2.02E+11,,mg/mÂ³,,1 Hr,442920,99999,2.02E+11,990,2,,722,CLR,,,,3.8,,,,,,,,,,34,18,,30.12,,,,,,,,
Ulaanbaatar_ HourlyPM25_201511.CSV,Ulaanbaatar,2/5/2018 12:00,11/1/2015 5:00,2015,11,1,5,2.02E+11,,mg/mÂ³,,1 Hr,442920,99999,2.02E+11,990,2,,722,CLR,,,,5,,,,,,,,,,36,18,,30.09,,,,,,,,
Ulaanbaatar_ HourlyPM25_201511.CSV,Ulaanbaatar,2/5/2018 12:00,11/1/2015 6:00,2015,11,1,6,2.02E+11,,mg/mÂ³,,1 Hr,442920,99999,2.02E+11,990,2,,,BKN,,,,2.5,4,,,,,,,,2,39,16,1022.7,,871.4,,,,,,,
Ulaanbaatar_ HourlyPM25_201511.CSV,Ulaanbaatar,2/5/2018 12:00,11/1/2015 7:00,2015,11,1,7,2.02E+11,,mg/mÂ³,,1 Hr,442920,99999,2.02E+11,990,2,,,,,,,,,,,,,,,,,41,18,,30.06,,,,,,,,
Ulaanbaatar_ HourlyPM25_201511.CSV,Ulaanbaatar,2/5/2018 12:00,11/1/2015 8:00,2015,11,1,8,2.02E+11,,mg/mÂ³,,1 Hr,442920,99999,2.02E+11,990,2,,,,,,,,,,,,,,,,,43,19,,30.03,,,,,,,,
Ulaanbaatar_ HourlyPM25_201511.CSV,Ulaanbaatar,2/5/2018 12:00,11/1/2015 9:00,2015,11,1,9,2.02E+11,,mg/mÂ³,,1 Hr,442920,99999,2.02E+11,,,,,BKN,,,,6.2,4,,,,,,,,2,43,25,1020.3,30.03,,,,,,,,
Ulaanbaatar_ HourlyPM25_201511.CSV,Ulaanbaatar,2/5/2018 12:00,11/1/2015 10:00,2015,11,1,10,2.02E+11,,mg/mÂ³,,1 Hr,442920,99999,2.02E+11,990,4,,,,,,,,,,,,,,,,,30,23,,30,,,,,,,,
Ulaanbaatar_ HourlyPM25_201511.CSV,Ulaanbaatar,2/5/2018 12:00,11/1/2015 11:00,2015,11,1,11,2.02E+11,,mg/mÂ³,,1 Hr,442920,99999,2.02E+11,990,2,,,,,,,,,,,,,,,,,30,21,,30,,,,,,,,
Ulaanbaatar_ HourlyPM25_201511.CSV,Ulaanbaatar,2/5/2018 12:00,11/1/2015 12:00,2015,11,1,12,2.02E+11,,mg/mÂ³,,1 Hr,442920,99999,2.02E+11,90,2,,,BKN,,,,,,,,,,,,,,36,23,1022.3,30,,46,,,,,,
Ulaanbaatar_ HourlyPM25_201511.CSV,Ulaanbaatar,2/5/2018 12:00,11/1/2015 13:00,2015,11,1,13,2.02E+11,,mg/mÂ³,,1 Hr,442920,99999,2.02E+11,,0,,,,,,,,,,,,,,,,,27,21,,30,,,,,,,,
Ulaanbaatar_ HourlyPM25_201511.CSV,Ulaanbaatar,2/5/2018 12:00,11/1/2015 14:00,2015,11,1,14,2.02E+11,,mg/mÂ³,,1 Hr,442920,99999,2.02E+11,990,2,,,,,,,,,,,,,,,,,27,21,,29.97,,,,,,,,
Ulaanbaatar_ HourlyPM25_201511.CSV,Ulaanbaatar,2/5/2018 12:00,11/1/2015 15:00,2015,11,1,15,2.02E+11,,mg/mÂ³,,1 Hr,442920,99999,2.02E+11,990,2,,,SCT,,,,31.2,,,,,,,,,,28,20,1022.1,29.97,,,,,,,,
Ulaanbaatar_ HourlyPM25_201511.CSV,Ulaanbaatar,2/5/2018 12:00,11/1/2015 16:00,2015,11,1,16,2.02E+11,,mg/mÂ³,,1 Hr,442920,99999,2.02E+11,990,2,,,,,,,,,,,,,,,,,28,21,,29.94,,,,,,,,
Ulaanbaatar_ HourlyPM25_201511.CSV,Ulaanbaatar,2/5/2018 12:00,11/1/2015 17:00,2015,11,1,17,2.02E+11,,mg/mÂ³,,1 Hr,442920,99999,2.02E+11,990,4,,,,,,,,,,,,,,,,,28,21,,29.94,,,,,,,,
Ulaanbaatar_ HourlyPM25_201511.CSV,Ulaanbaatar,2/5/2018 12:00,11/1/2015 18:00,2015,11,1,18,2.02E+11,,mg/mÂ³,,1 Hr,442920,99999,2.02E+11,,,,,SCT,,,,31.2,,,,,,,,,,36,18,1018.7,29.91,,,,,,,,
Ulaanbaatar_ HourlyPM25_201511.CSV,Ulaanbaatar,2/5/2018 12:00,11/1/2015 19:00,2015,11,1,19,2.02E+11,,mg/mÂ³,,1 Hr,442920,99999,2.02E+11,280,7,,,,,,,6.2,,,,,,,,,,30,21,,29.88,,,,,,,,
Ulaanbaatar_ HourlyPM25_201511.CSV,Ulaanbaatar,2/5/2018 12:00,11/1/2015 20:00,2015,11,1,20,2.02E+11,,mg/mÂ³,,1 Hr,442920,99999,2.02E+11,990,2,,,,,,,6.2,,,,,,,,,,30,19,,29.88,,,,,,,,
Ulaanbaatar_ HourlyPM25_201511.CSV,Ulaanbaatar,2/5/2018 12:00,11/1/2015 21:00,2015,11,1,21,2.02E+11,,mg/mÂ³,,1 Hr,442920,99999,2.02E+11,80,9,,,,,,,31.2,,,,,,,,,,27,18,1016.9,29.85,,,,,,,,
Ulaanbaatar_ HourlyPM25_201511.CSV,Ulaanbaatar,2/5/2018 12:00,11/1/2015 22:00,2015,11,1,22,2.02E+11,,mg/mÂ³,,1 Hr,442920,99999,2.02E+11,990,2,,,,,,,,,,,,,,,,,32,16,,29.85,,,,,,,,
Ulaanbaatar_ HourlyPM25_201511.CSV,Ulaanbaatar,2/5/2018 12:00,11/1/2015 23:00,2015,11,1,23,2.02E+11,,mg/mÂ³,,1 Hr,442920,99999,2.02E+11,990,2,,,,,,,,,,,,,,,,,27,18,,29.85,,,,,,,,
Ulaanbaatar_ HourlyPM25_201511.CSV,Ulaanbaatar,2/5/2018 12:00,11/2/2015 0:00,2015,11,2,0,2.02E+11,,mg/mÂ³,,1 Hr,442920,99999,2.02E+11,990,2,,,BKN,,,,6.2,,,,,,,,,,25,18,1018.2,29.85,,,,,,,,
Ulaanbaatar_ HourlyPM25_201511.CSV,Ulaanbaatar,2/5/2018 12:00,11/2/2015 1:00,2015,11,2,1,2.02E+11,,mg/mÂ³,,1 Hr,442920,99999,2.02E+11,990,2,,250,,,,,6.2,,,,,,,,,,30,21,,29.88,,,,,,,,
Ulaanbaatar_ HourlyPM25_201511.CSV,Ulaanbaatar,2/5/2018 12:00,11/2/2015 2:00,2015,11,2,2,2.02E+11,,mg/mÂ³,,1 Hr,442920,99999,2.02E+11,990,2,,250,,,,,6.2,,,,,,,,,,34,18,,29.88,,,,,,,,
Ulaanbaatar_ HourlyPM25_201511.CSV,Ulaanbaatar,2/5/2018 12:00,11/2/2015 3:00,2015,11,2,3,2.02E+11,,mg/mÂ³,,1 Hr,442920,99999,2.02E+11,990,2,,250,BKN,,,,5,4,,,,,,,,2,37,15,1015.3,29.88,,,,,,,,
Ulaanbaatar_ HourlyPM25_201511.CSV,Ulaanbaatar,2/5/2018 12:00,11/2/2015 4:00,2015,11,2,4,2.02E+11,,mg/mÂ³,,1 Hr,442920,99999,2.02E+11,990,2,,250,,,,,5,,,,,,,,,,39,19,,29.88,,,,,,,,
Ulaanbaatar_ HourlyPM25_201511.CSV,Ulaanbaatar,2/5/2018 12:00,11/2/2015 5:00,2015,11,2,5,2.02E+11,,mg/mÂ³,,1 Hr,442920,99999,2.02E+11,990,2,,250,,,,,5,,,,,,,,,,45,19,,29.85,,,,,,,,
Ulaanbaatar_ HourlyPM25_201511.CSV,Ulaanbaatar,2/5/2018 12:00,11/2/2015 6:00,2015,11,2,6,2.02E+11,,mg/mÂ³,,1 Hr,442920,99999,2.02E+11,990,2,,250,BKN,,,,6.2,4,,,,,,,,2,49,14,1013.6,,864.5,,,,,,,
Ulaanbaatar_ HourlyPM25_201511.CSV,Ulaanbaatar,2/5/2018 12:00,11/2/2015 7:00,2015,11,2,7,2.02E+11,,mg/mÂ³,,1 Hr,442920,99999,2.02E+11,990,2,,250,,,,,6.2,,,,,,,,,,48,18,,29.83,,,,,,,,
Ulaanbaatar_ HourlyPM25_201511.CSV,Ulaanbaatar,2/5/2018 12:00,11/2/2015 8:00,2015,11,2,8,2.02E+11,,mg/mÂ³,,1 Hr,442920,99999,2.02E+11,990,2,,250,,,,,6.2,,,,,,,,,,46,23,,29.83,,,,,,,,
Ulaanbaatar_ HourlyPM25_201511.CSV,Ulaanbaatar,2/5/2018 12:00,11/2/2015 9:00,2015,11,2,9,2.02E+11,,mg/mÂ³,,1 Hr,442920,99999,2.02E+11,,,,250,,,,,6.2,4,,,,,,,,2,45,18,1011.4,29.8,,,,,,,,
Ulaanbaatar_ HourlyPM25_201511.CSV,Ulaanbaatar,2/5/2018 12:00,11/2/2015 10:00,2015,11,2,10,2.02E+11,,mg/mÂ³,,1 Hr,442920,99999,2.02E+11,170,7,,,,,,,,,,,,,,,,,34,25,,29.8,,,,,,,,
Ulaanbaatar_ HourlyPM25_201511.CSV,Ulaanbaatar,2/5/2018 12:00,11/2/2015 11:00,2015,11,2,11,2.02E+11,,mg/mÂ³,,1 Hr,442920,99999,2.02E+11,990,2,,,,,,,,,,,,,,,,,34,25,,29.83,,,,,,,,
Ulaanbaatar_ HourlyPM25_201511.CSV,Ulaanbaatar,2/5/2018 12:00,11/2/2015 12:00,2015,11,2,12,2.02E+11,,mg/mÂ³,,1 Hr,442920,99999,2.02E+11,,,,,,,,,31.2,,,,,,,,,,34,25,1013.3,29.8,,51,,,,,,
Ulaanbaatar_ HourlyPM25_201511.CSV,Ulaanbaatar,2/5/2018 12:00,11/2/2015 13:00,2015,11,2,13,2.02E+11,,mg/mÂ³,,1 Hr,442920,99999,2.02E+11,990,2,,,,,,,,,,,,,,,,,34,25,,29.8,,,,,,,,
Ulaanbaatar_ HourlyPM25_201511.CSV,Ulaanbaatar,2/5/2018 12:00,11/2/2015 14:00,2015,11,2,14,2.02E+11,,mg/mÂ³,,1 Hr,442920,99999,2.02E+11,990,2,,,,,,,,,,,,,,,,,30,25,,29.77,,,,,,,,
Ulaanbaatar_ HourlyPM25_201511.CSV,Ulaanbaatar,2/5/2018 12:00,11/2/2015 15:00,2015,11,2,15,2.02E+11,,mg/mÂ³,,1 Hr,442920,99999,2.02E+11,80,4,,,,,,,31.2,,,,,,,,,,30,25,1012.3,29.77,,,,,,,,
Ulaanbaatar_ HourlyPM25_201511.CSV,Ulaanbaatar,2/5/2018 12:00,11/2/2015 16:00,2015,11,2,16,2.02E+11,0.055,mg/mÂ³,149,1 Hr,442920,99999,2.02E+11,990,2,,,,,,,,,,,,,,,,,32,25,,29.74,,,,,,,,
Ulaanbaatar_ HourlyPM25_201511.CSV,Ulaanbaatar,2/5/2018 12:00,11/2/2015 17:00,2015,11,2,17,2.02E+11,0.064,mg/mÂ³,155,1 Hr,442920,99999,2.02E+11,990,4,,,,,,,,,,,,,,,,,41,21,,29.71,,,,,,,,
Ulaanbaatar_ HourlyPM25_201511.CSV,Ulaanbaatar,2/5/2018 12:00,11/2/2015 18:00,2015,11,2,18,2.02E+11,0.191,mg/mÂ³,241,1 Hr,442920,99999,2.02E+11,80,2,,,SCT,,,,31.2,,,,,,,,,,43,19,1009.5,29.68,,,,,,,,
Ulaanbaatar_ HourlyPM25_201511.CSV,Ulaanbaatar,2/5/2018 12:00,11/2/2015 19:00,2015,11,2,19,2.02E+11,0.231,mg/mÂ³,281,1 Hr,442920,99999,2.02E+11,140,18,,,,,,,,,,,,,,,,,43,16,,29.65,,,,,,,,
Ulaanbaatar_ HourlyPM25_201511.CSV,Ulaanbaatar,2/5/2018 12:00,11/2/2015 20:00,2015,11,2,20,2.02E+11,0.258,mg/mÂ³,307,1 Hr,442920,99999,2.02E+11,140,20,,,,,,,,,,,,,,,,,43,18,,29.59,,,,,,,,
Ulaanbaatar_ HourlyPM25_201511.CSV,Ulaanbaatar,2/5/2018 12:00,11/2/2015 21:00,2015,11,2,21,2.02E+11,0.212,mg/mÂ³,262,1 Hr,442920,99999,2.02E+11,,,29,,,,,,31.2,,,,,,,,,,45,16,1005.9,29.56,,,,,,,,
Ulaanbaatar_ HourlyPM25_201511.CSV,Ulaanbaatar,2/5/2018 12:00,11/2/2015 22:00,2015,11,2,22,2.02E+11,0.297,mg/mÂ³,338,1 Hr,442920,99999,2.02E+11,990,9,,,,,,,,,,,,,,,,,41,18,,29.59,,,,,,,,
Ulaanbaatar_ HourlyPM25_201511.CSV,Ulaanbaatar,2/5/2018 12:00,11/2/2015 23:00,2015,11,2,23,2.02E+11,0.26,mg/mÂ³,309,1 Hr,442920,99999,2.02E+11,990,4,,,,,,,,,,,,,,,,,41,18,,29.59,,,,,,,,
Ulaanbaatar_ HourlyPM25_201511.CSV,Ulaanbaatar,2/5/2018 12:00,11/3/2015 0:00,2015,11,3,0,2.02E+11,0.068,mg/mÂ³,157,1 Hr,442920,99999,2.02E+11,,,,,,,,,6.2,4,,,,,,,,0,34,21,1009.4,29.62,,,33,,,,,
Ulaanbaatar_ HourlyPM25_201511.CSV,Ulaanbaatar,2/5/2018 12:00,11/3/2015 1:00,2015,11,3,1,2.02E+11,0.027,mg/mÂ³,82,1 Hr,442920,99999,2.02E+11,,0,,100,,,,,6.2,,,,,,,,,,34,23,,29.62,,,,,,,,
Ulaanbaatar_ HourlyPM25_201511.CSV,Ulaanbaatar,2/5/2018 12:00,11/3/2015 2:00,2015,11,3,2,2.02E+11,0.022,mg/mÂ³,72,1 Hr,442920,99999,2.02E+11,,0,,100,,,,,6.2,,,,,,,,,,39,19,,29.65,,,,,,,,
Ulaanbaatar_ HourlyPM25_201511.CSV,Ulaanbaatar,2/5/2018 12:00,11/3/2015 3:00,2015,11,3,3,2.02E+11,0.018,mg/mÂ³,63,1 Hr,442920,99999,2.02E+11,310,11,,33,,,,,6.2,,,,,,,,,,41,21,1010.9,29.68,,,,,,,,
Ulaanbaatar_ HourlyPM25_201511.CSV,Ulaanbaatar,2/5/2018 12:00,11/3/2015 4:00,2015,11,3,4,2.02E+11,0.015,mg/mÂ³,57,1 Hr,442920,99999,2.02E+11,990,9,,33,,,,,6.2,68,,,,,,,,,34,27,,29.77,,,,,,,,
Ulaanbaatar_ HourlyPM25_201511.CSV,Ulaanbaatar,2/5/2018 12:00,11/3/2015 5:00,2015,11,3,5,2.02E+11,0.037,mg/mÂ³,105,1 Hr,442920,99999,2.02E+11,320,18,,30,,,,,6.2,,,,,,,,,,34,27,,29.8,,,,,,,,
Ulaanbaatar_ HourlyPM25_201511.CSV,Ulaanbaatar,2/5/2018 12:00,11/3/2015 6:00,2015,11,3,6,2.02E+11,0.033,mg/mÂ³,95,1 Hr,442920,99999,2.02E+11,300,11,,100,,,,,6.2,2,,,,,,,,7,34,26,1017,29.83,,,,,,,,
Ulaanbaatar_ HourlyPM25_201511.CSV,Ulaanbaatar,2/5/2018 12:00,11/3/2015 7:00,2015,11,3,7,2.02E+11,0.069,mg/mÂ³,158,1 Hr,442920,99999,2.02E+11,330,16,,30,,,,,6.2,,,,,,,,,,32,25,,29.85,,,,,,,,
Ulaanbaatar_ HourlyPM25_201511.CSV,Ulaanbaatar,2/5/2018 12:00,11/3/2015 8:00,2015,11,3,8,2.02E+11,0.174,mg/mÂ³,224,1 Hr,442920,99999,2.02E+11,990,11,,30,,,,,6.2,,,,,,,,,,30,23,,29.88,,,,,,,,
Ulaanbaatar_ HourlyPM25_201511.CSV,Ulaanbaatar,2/5/2018 12:00,11/3/2015 9:00,2015,11,3,9,2.02E+11,0.268,mg/mÂ³,315,1 Hr,442920,99999,2.02E+11,310,7,,30,,,,,6.2,,,,,,,,,,30,23,1021.1,29.91,,,,,,,,
Ulaanbaatar_ HourlyPM25_201511.CSV,Ulaanbaatar,2/5/2018 12:00,11/3/2015 10:00,2015,11,3,10,2.02E+11,0.285,mg/mÂ³,329,1 Hr,442920,99999,2.02E+11,290,9,,30,,,,,6.2,,,,,,,,,,27,21,,29.94,,,,,,,,
Ulaanbaatar_ HourlyPM25_201511.CSV,Ulaanbaatar,2/5/2018 12:00,11/3/2015 11:00,2015,11,3,11,2.02E+11,0.055,mg/mÂ³,149,1 Hr,442920,99999,2.02E+11,300,11,,33,,,,,6.2,,,,,,,,,,27,21,,29.97,,,,,,,,
Ulaanbaatar_ HourlyPM25_201511.CSV,Ulaanbaatar,2/5/2018 12:00,11/3/2015 12:00,2015,11,3,12,2.02E+11,0.037,mg/mÂ³,105,1 Hr,442920,99999,2.02E+11,330,11,,33,BKN,,,,6.2,70,,,,,,,,7,27,20,1026.6,,869.8,41,,,,,0,T
Ulaanbaatar_ HourlyPM25_201511.CSV,Ulaanbaatar,2/5/2018 12:00,11/3/2015 13:00,2015,11,3,13,2.02E+11,0.037,mg/mÂ³,105,1 Hr,442920,99999,2.02E+11,320,18,,33,,,,,6.2,,,,,,,,,,23,18,,30.06,,,,,,,,
Ulaanbaatar_ HourlyPM25_201511.CSV,Ulaanbaatar,2/5/2018 12:00,11/3/2015 14:00,2015,11,3,14,2.02E+11,0.028,mg/mÂ³,84,1 Hr,442920,99999,2.02E+11,340,13,,33,,,,,6.2,,,,,,,,,,21,14,,30.09,,,,,,,,
Ulaanbaatar_ HourlyPM25_201511.CSV,Ulaanbaatar,2/5/2018 12:00,11/3/2015 15:00,2015,11,3,15,2.02E+11,0.018,mg/mÂ³,63,1 Hr,442920,99999,2.02E+11,340,7,,,BKN,,,,6.2,70,,,,,,,,7,20,12,1032.2,,872.9,,,,,,,
Ulaanbaatar_ HourlyPM25_201511.CSV,Ulaanbaatar,2/5/2018 12:00,11/3/2015 16:00,2015,11,3,16,2.02E+11,0.025,mg/mÂ³,78,1 Hr,442920,99999,2.02E+11,340,13,,,,,,,6.2,,,,,,,,,,18,12,,30.15,,,,,,,,
Ulaanbaatar_ HourlyPM25_201511.CSV,Ulaanbaatar,2/5/2018 12:00,11/3/2015 17:00,2015,11,3,17,2.02E+11,0.022,mg/mÂ³,72,1 Hr,442920,99999,2.02E+11,350,11,,,,,,,6.2,,,,,,,,,,18,10,,30.18,,,,,,,,
Ulaanbaatar_ HourlyPM25_201511.CSV,Ulaanbaatar,2/5/2018 12:00,11/3/2015 18:00,2015,11,3,18,2.02E+11,0.023,mg/mÂ³,74,1 Hr,442920,99999,2.02E+11,290,7,,,,,,,31.2,1,,,,,,,,7,17,11,1035.1,30.21,,,,,,,,
Ulaanbaatar_ HourlyPM25_201511.CSV,Ulaanbaatar,2/5/2018 12:00,11/3/2015 19:00,2015,11,3,19,2.02E+11,0.027,mg/mÂ³,82,1 Hr,442920,99999,2.02E+11,340,9,,,,,,,6.2,,,,,,,,,,16,10,,30.21,,,,,,,,
Ulaanbaatar_ HourlyPM25_201511.CSV,Ulaanbaatar,2/5/2018 12:00,11/3/2015 20:00,2015,11,3,20,2.02E+11,0.022,mg/mÂ³,72,1 Hr,442920,99999,2.02E+11,330,9,,,,,,,6.2,,,,,,,,,,16,9,,30.24,,,,,,,,
Ulaanbaatar_ HourlyPM25_201511.CSV,Ulaanbaatar,2/5/2018 12:00,11/3/2015 21:00,2015,11,3,21,2.02E+11,0.023,mg/mÂ³,74,1 Hr,442920,99999,2.02E+11,320,4,,,SCT,,,,31.2,,,,,,,,,,14,10,1037.3,30.24,,,,,,,,
Ulaanbaatar_ HourlyPM25_201511.CSV,Ulaanbaatar,2/5/2018 12:00,11/3/2015 22:00,2015,11,3,22,2.02E+11,0.023,mg/mÂ³,74,1 Hr,442920,99999,2.02E+11,990,2,,,,,,,,,,,,,,,,,12,9,,30.27,,,,,,,,
Ulaanbaatar_ HourlyPM25_201511.CSV,Ulaanbaatar,2/5/2018 12:00,11/3/2015 23:00,2015,11,3,23,2.02E+11,0.021,mg/mÂ³,70,1 Hr,442920,99999,2.02E+11,990,2,,,,,,,,,,,,,,,,,14,9,,30.3,,,,,,,,
Ulaanbaatar_ HourlyPM25_201511.CSV,Ulaanbaatar,2/5/2018 12:00,11/4/2015 0:00,2015,11,4,0,2.02E+11,0.023,mg/mÂ³,74,1 Hr,442920,99999,2.02E+11,300,7,,100,,,,,6.2,4,,,,,,,,2,14,9,1040.5,30.33,,,14,,,,0,T
Ulaanbaatar_ HourlyPM25_201511.CSV,Ulaanbaatar,2/5/2018 12:00,11/4/2015 1:00,2015,11,4,1,2.02E+11,0.019,mg/mÂ³,66,1 Hr,442920,99999,2.02E+11,300,4,,,,,,,6.2,,,,,,,,,,14,9,,30.36,,,,,,,,
Ulaanbaatar_ HourlyPM25_201511.CSV,Ulaanbaatar,2/5/2018 12:00,11/4/2015 2:00,2015,11,4,2,2.02E+11,0.018,mg/mÂ³,63,1 Hr,442920,99999,2.02E+11,990,2,,,,,,,6.2,,,,,,,,,,16,9,,30.36,,,,,,,,
Ulaanbaatar_ HourlyPM25_201511.CSV,Ulaanbaatar,2/5/2018 12:00,11/4/2015 3:00,2015,11,4,3,2.02E+11,0.017,mg/mÂ³,61,1 Hr,442920,99999,2.02E+11,,,,33,,,,,6.2,4,,,,,,,,2,19,9,1040.4,30.39,,,,,,,,
Ulaanbaatar_ HourlyPM25_201511.CSV,Ulaanbaatar,2/5/2018 12:00,11/4/2015 4:00,2015,11,4,4,2.02E+11,0.018,mg/mÂ³,63,1 Hr,442920,99999,2.02E+11,990,7,,,,,,,6.2,,,,,,,,,,19,9,,30.39,,,,,,,,
Ulaanbaatar_ HourlyPM25_201511.CSV,Ulaanbaatar,2/5/2018 12:00,11/4/2015 5:00,2015,11,4,5,2.02E+11,0.018,mg/mÂ³,63,1 Hr,442920,99999,2.02E+11,990,11,,33,,,,,6.2,,,,,,,,,,21,7,,30.39,,,,,,,,
Ulaanbaatar_ HourlyPM25_201511.CSV,Ulaanbaatar,2/5/2018 12:00,11/4/2015 6:00,2015,11,4,6,2.02E+11,0.017,mg/mÂ³,61,1 Hr,442920,99999,2.02E+11,260,11,,33,,,,,6.2,,,,,,,,,,20,7,1040.3,,879.8,,,,,,,
Ulaanbaatar_ HourlyPM25_201511.CSV,Ulaanbaatar,2/5/2018 12:00,11/4/2015 7:00,2015,11,4,7,2.02E+11,0.02,mg/mÂ³,68,1 Hr,442920,99999,2.02E+11,990,9,,33,,,,,6.2,,,,,,,,,,19,7,,30.39,,,,,,,,
Ulaanbaatar_ HourlyPM25_201511.CSV,Ulaanbaatar,2/5/2018 12:00,11/4/2015 8:00,2015,11,4,8,2.02E+11,0.032,mg/mÂ³,93,1 Hr,442920,99999,2.02E+11,990,9,,33,,,,,6.2,,,,,,,,,,21,5,,30.39,,,,,,,,
Ulaanbaatar_ HourlyPM25_201511.CSV,Ulaanbaatar,2/5/2018 12:00,11/4/2015 9:00,2015,11,4,9,2.02E+11,0.044,mg/mÂ³,122,1 Hr,442920,99999,2.02E+11,320,9,,,,,,,6.2,,,,,,,,,,19,7,1041,30.39,,,,,,,,
Ulaanbaatar_ HourlyPM25_201511.CSV,Ulaanbaatar,2/5/2018 12:00,11/4/2015 10:00,2015,11,4,10,2.02E+11,0.038,mg/mÂ³,107,1 Hr,442920,99999,2.02E+11,350,7,,,,,,,6.2,,,,,,,,,,18,7,,30.39,,,,,,,,
Ulaanbaatar_ HourlyPM25_201511.CSV,Ulaanbaatar,2/5/2018 12:00,11/4/2015 11:00,2015,11,4,11,2.02E+11,0.041,mg/mÂ³,115,1 Hr,442920,99999,2.02E+11,360,4,,,,,,,,,,,,,,,,,16,5,,30.42,,,,,,,,
Ulaanbaatar_ HourlyPM25_201511.CSV,Ulaanbaatar,2/5/2018 12:00,11/4/2015 12:00,2015,11,4,12,2.02E+11,0.021,mg/mÂ³,70,1 Hr,442920,99999,2.02E+11,,,,,,,,,31.2,,,,,,,,,,15,6,1044.5,,881.9,23,,,,,,
Ulaanbaatar_ HourlyPM25_201511.CSV,Ulaanbaatar,2/5/2018 12:00,11/4/2015 13:00,2015,11,4,13,2.02E+11,0.022,mg/mÂ³,72,1 Hr,442920,99999,2.02E+11,180,4,,,,,,,,,,,,,,,,,9,3,,30.47,,,,,,,,
Ulaanbaatar_ HourlyPM25_201511.CSV,Ulaanbaatar,2/5/2018 12:00,11/4/2015 14:00,2015,11,4,14,2.02E+11,0.019,mg/mÂ³,66,1 Hr,442920,99999,2.02E+11,990,4,,,,,,,,,,,,,,,,,7,3,,30.47,,,,,,,,
Ulaanbaatar_ HourlyPM25_201511.CSV,Ulaanbaatar,2/5/2018 12:00,11/4/2015 15:00,2015,11,4,15,2.02E+11,0.022,mg/mÂ³,72,1 Hr,442920,99999,2.02E+11,50,2,,,,,,,31.2,,,,,,,,,,7,1,1046.9,30.47,,,,,,,,
Ulaanbaatar_ HourlyPM25_201511.CSV,Ulaanbaatar,2/5/2018 12:00,11/4/2015 16:00,2015,11,4,16,2.02E+11,0.025,mg/mÂ³,78,1 Hr,442920,99999,2.02E+11,990,4,,,,,,,,,,,,,,,,,5,0,,30.5,,,,,,,,
Ulaanbaatar_ HourlyPM25_201511.CSV,Ulaanbaatar,2/5/2018 12:00,11/4/2015 17:00,2015,11,4,17,2.02E+11,0.028,mg/mÂ³,84,1 Hr,442920,99999,2.02E+11,990,2,,,,,,,,,,,,,,,,,5,1,,30.5,,,,,,,,
Ulaanbaatar_ HourlyPM25_201511.CSV,Ulaanbaatar,2/5/2018 12:00,11/4/2015 18:00,2015,11,4,18,2.02E+11,0.034,mg/mÂ³,97,1 Hr,442920,99999,2.02E+11,40,2,,,,,,,31.2,,,,,,,,,,3,-2,1048.7,30.5,,,,,,,,
Ulaanbaatar_ HourlyPM25_201511.CSV,Ulaanbaatar,2/5/2018 12:00,11/4/2015 19:00,2015,11,4,19,2.02E+11,0.053,mg/mÂ³,144,1 Hr,442920,99999,2.02E+11,190,4,,,,,,,,,,,,,,,,,1,-4,,30.5,,,,,,,,
Ulaanbaatar_ HourlyPM25_201511.CSV,Ulaanbaatar,2/5/2018 12:00,11/4/2015 20:00,2015,11,4,20,2.02E+11,0.087,mg/mÂ³,167,1 Hr,442920,99999,2.02E+11,990,2,,,,,,,,,,,,,,,,,1,-2,,30.5,,,,,,,,
Ulaanbaatar_ HourlyPM25_201511.CSV,Ulaanbaatar,2/5/2018 12:00,11/4/2015 21:00,2015,11,4,21,2.02E+11,0.145,mg/mÂ³,197,1 Hr,442920,99999,2.02E+11,70,2,,,,,,,31.2,,,,,,,,,,1,-4,1049.2,30.5,,,,,,,,
Ulaanbaatar_ HourlyPM25_201511.CSV,Ulaanbaatar,2/5/2018 12:00,11/4/2015 22:00,2015,11,4,22,2.02E+11,0.121,mg/mÂ³,185,1 Hr,442920,99999,2.02E+11,990,2,,,,,,,,,,,,,,,,,-2,-8,,30.5,,,,,,,,
Ulaanbaatar_ HourlyPM25_201511.CSV,Ulaanbaatar,2/5/2018 12:00,11/4/2015 23:00,2015,11,4,23,2.02E+11,0.109,mg/mÂ³,179,1 Hr,442920,99999,2.02E+11,,0,,,,,,,,,,,,,,,,,0,-6,,30.5,,,,,,,,
Ulaanbaatar_ HourlyPM25_201511.CSV,Ulaanbaatar,2/5/2018 12:00,11/5/2015 0:00,2015,11,5,0,2.02E+11,0.088,mg/mÂ³,168,1 Hr,442920,99999,2.02E+11,80,7,,,,,,,6.2,4,,,,,,,,0,1,-4,1050.2,30.53,,,,,,,,
Ulaanbaatar_ HourlyPM25_201511.CSV,Ulaanbaatar,2/5/2018 12:00,11/5/2015 1:00,2015,11,5,1,2.02E+11,0.06,mg/mÂ³,153,1 Hr,442920,99999,2.02E+11,990,2,,,,,,,,,,,,,,,,,5,-2,,30.53,,,,,,,,
Ulaanbaatar_ HourlyPM25_201511.CSV,Ulaanbaatar,2/5/2018 12:00,11/5/2015 2:00,2015,11,5,2,2.02E+11,0.08,mg/mÂ³,164,1 Hr,442920,99999,2.02E+11,990,2,,,,,,,,,,,,,,,,,9,0,,30.53,,,,,,,,
Ulaanbaatar_ HourlyPM25_201511.CSV,Ulaanbaatar,2/5/2018 12:00,11/5/2015 3:00,2015,11,5,3,2.02E+11,0.04,mg/mÂ³,112,1 Hr,442920,99999,2.02E+11,,0,,,,,,,6.2,4,,,,,,,,0,16,-1,1046.6,,884.1,,,,,,,
Ulaanbaatar_ HourlyPM25_201511.CSV,Ulaanbaatar,2/5/2018 12:00,11/5/2015 4:00,2015,11,5,4,2.02E+11,0.039,mg/mÂ³,110,1 Hr,442920,99999,2.02E+11,990,2,,,,,,,,,,,,,,,,,18,3,,30.5,,,,,,,,
Ulaanbaatar_ HourlyPM25_201511.CSV,Ulaanbaatar,2/5/2018 12:00,11/5/2015 5:00,2015,11,5,5,2.02E+11,0.032,mg/mÂ³,93,1 Hr,442920,99999,2.02E+11,,0,,,,,,,,,,,,,,,,,21,1,,30.47,,,,,,,,
Ulaanbaatar_ HourlyPM25_201511.CSV,Ulaanbaatar,2/5/2018 12:00,11/5/2015 6:00,2015,11,5,6,2.02E+11,0.03,mg/mÂ³,89,1 Hr,442920,99999,2.02E+11,990,4,,,,,,,12.5,4,,,,,,,,0,25,0,1042.1,30.47,,,,,,,,
Ulaanbaatar_ HourlyPM25_201511.CSV,Ulaanbaatar,2/5/2018 12:00,11/5/2015 7:00,2015,11,5,7,2.02E+11,0.049,mg/mÂ³,134,1 Hr,442920,99999,2.02E+11,140,7,,,,,,,,,,,,,,,,,25,0,,30.45,,,,,,,,
Ulaanbaatar_ HourlyPM25_201511.CSV,Ulaanbaatar,2/5/2018 12:00,11/5/2015 8:00,2015,11,5,8,2.02E+11,0.08,mg/mÂ³,164,1 Hr,442920,99999,2.02E+11,190,7,,,,,,,,,,,,,,,,,25,0,,30.42,,,,,,,,
Ulaanbaatar_ HourlyPM25_201511.CSV,Ulaanbaatar,2/5/2018 12:00,11/5/2015 9:00,2015,11,5,9,2.02E+11,0.173,mg/mÂ³,223,1 Hr,442920,99999,2.02E+11,990,4,,,SCT,,,,12.5,4,,,,,,,,0,25,-1,1039.9,,881,,,,,,,
Ulaanbaatar_ HourlyPM25_201511.CSV,Ulaanbaatar,2/5/2018 12:00,11/5/2015 10:00,2015,11,5,10,2.02E+11,0.045,mg/mÂ³,124,1 Hr,442920,99999,2.02E+11,170,7,,,,,,,,,,,,,,,,,18,5,,30.42,,,,,,,,
Ulaanbaatar_ HourlyPM25_201511.CSV,Ulaanbaatar,2/5/2018 12:00,11/5/2015 11:00,2015,11,5,11,2.02E+11,0.038,mg/mÂ³,107,1 Hr,442920,99999,2.02E+11,170,9,,,,,,,,,,,,,,,,,16,3,,30.42,,,,,,,,
Ulaanbaatar_ HourlyPM25_201511.CSV,Ulaanbaatar,2/5/2018 12:00,11/5/2015 12:00,2015,11,5,12,2.02E+11,0.03,mg/mÂ³,89,1 Hr,442920,99999,2.02E+11,70,4,,,,,,,31.2,,,,,,,,,,14,1,1042.3,30.42,,28,,,,,,
Ulaanbaatar_ HourlyPM25_201511.CSV,Ulaanbaatar,2/5/2018 12:00,11/5/2015 13:00,2015,11,5,13,2.02E+11,0.031,mg/mÂ³,91,1 Hr,442920,99999,2.02E+11,990,2,,,,,,,,,,,,,,,,,14,1,,30.42,,,,,,,,
Ulaanbaatar_ HourlyPM25_201511.CSV,Ulaanbaatar,2/5/2018 12:00,11/5/2015 14:00,2015,11,5,14,2.02E+11,0.027,mg/mÂ³,82,1 Hr,442920,99999,2.02E+11,990,2,,,,,,,,,,,,,,,,,12,1,,30.45,,,,,,,,
Ulaanbaatar_ HourlyPM25_201511.CSV,Ulaanbaatar,2/5/2018 12:00,11/5/2015 15:00,2015,11,5,15,2.02E+11,0.023,mg/mÂ³,74,1 Hr,442920,99999,2.02E+11,990,2,,,,,,,31.2,,,,,,,,,,9,1,1044.1,30.45,,,,,,,,
Ulaanbaatar_ HourlyPM25_201511.CSV,Ulaanbaatar,2/5/2018 12:00,11/5/2015 16:00,2015,11,5,16,2.02E+11,0.025,mg/mÂ³,78,1 Hr,442920,99999,2.02E+11,990,2,,,,,,,,,,,,,,,,,9,0,,30.45,,,,,,,,
Ulaanbaatar_ HourlyPM25_201511.CSV,Ulaanbaatar,2/5/2018 12:00,11/5/2015 17:00,2015,11,5,17,2.02E+11,0.034,mg/mÂ³,97,1 Hr,442920,99999,2.02E+11,990,2,,,,,,,,,,,,,,,,,5,-2,,30.42,,,,,,,,
Ulaanbaatar_ HourlyPM25_201511.CSV,Ulaanbaatar,2/5/2018 12:00,11/5/2015 18:00,2015,11,5,18,2.02E+11,0.034,mg/mÂ³,97,1 Hr,442920,99999,2.02E+11,990,2,,,,,,,31.2,,,,,,,,,,13,-1,1043.4,,880.5,,,,,,,
Ulaanbaatar_ HourlyPM25_201511.CSV,Ulaanbaatar,2/5/2018 12:00,11/5/2015 19:00,2015,11,5,19,2.02E+11,0.107,mg/mÂ³,178,1 Hr,442920,99999,2.02E+11,,0,,,,,,,,,,,,,,,,,3,-2,,30.42,,,,,,,,
Ulaanbaatar_ HourlyPM25_201511.CSV,Ulaanbaatar,2/5/2018 12:00,11/5/2015 20:00,2015,11,5,20,2.02E+11,0.169,mg/mÂ³,219,1 Hr,442920,99999,2.02E+11,990,2,,,,,,,,,,,,,,,,,3,-2,,30.39,,,,,,,,
Ulaanbaatar_ HourlyPM25_201511.CSV,Ulaanbaatar,2/5/2018 12:00,11/5/2015 21:00,2015,11,5,21,2.02E+11,0.172,mg/mÂ³,222,1 Hr,442920,99999,2.02E+11,90,4,,,,,,,31.2,,,,,,,,,,5,-2,1043.9,30.39,,,,,,,,
Ulaanbaatar_ HourlyPM25_201511.CSV,Ulaanbaatar,2/5/2018 12:00,11/5/2015 22:00,2015,11,5,22,2.02E+11,0.15,mg/mÂ³,200,1 Hr,442920,99999,2.02E+11,990,2,,,,,,,,,,,,,,,,,1,-4,,30.39,,,,,,,,
Ulaanbaatar_ HourlyPM25_201511.CSV,Ulaanbaatar,2/5/2018 12:00,11/5/2015 23:00,2015,11,5,23,2.02E+11,0.176,mg/mÂ³,226,1 Hr,442920,99999,2.02E+11,990,2,,,,,,,,,,,,,,,,,3,-4,,30.39,,,,,,,,
Ulaanbaatar_ HourlyPM25_201511.CSV,Ulaanbaatar,2/5/2018 12:00,11/6/2015 0:00,2015,11,6,0,2.02E+11,0.163,mg/mÂ³,213,1 Hr,442920,99999,2.02E+11,90,4,,,,,,,31.2,,,,,,,,,,1,-6,1045.1,30.39,,,,,,,,
Ulaanbaatar_ HourlyPM25_201511.CSV,Ulaanbaatar,2/5/2018 12:00,11/6/2015 1:00,2015,11,6,1,2.02E+11,0.154,mg/mÂ³,204,1 Hr,442920,99999,2.02E+11,,0,,,,,,,,,,,,,,,,,5,-2,,30.42,,,,,,,,
Ulaanbaatar_ HourlyPM25_201511.CSV,Ulaanbaatar,2/5/2018 12:00,11/6/2015 2:00,2015,11,6,2,2.02E+11,0.166,mg/mÂ³,216,1 Hr,442920,99999,2.02E+11,990,2,,722,CLR,,,,5,,,,,,,,,,10,1,,30.39,,,,,,,,
Ulaanbaatar_ HourlyPM25_201511.CSV,Ulaanbaatar,2/5/2018 12:00,11/6/2015 3:00,2015,11,6,3,2.02E+11,0.123,mg/mÂ³,186,1 Hr,442920,99999,2.02E+11,90,4,,,,,,,6.2,4,,,,,,,,2,16,1,1039.8,30.39,,,,,,,,
Ulaanbaatar_ HourlyPM25_201511.CSV,Ulaanbaatar,2/5/2018 12:00,11/6/2015 4:00,2015,11,6,4,2.02E+11,0.11,mg/mÂ³,179,1 Hr,442920,99999,2.02E+11,990,2,,250,,,,,5,,,,,,,,,,23,1,,30.36,,,,,,,,
Ulaanbaatar_ HourlyPM25_201511.CSV,Ulaanbaatar,2/5/2018 12:00,11/6/2015 5:00,2015,11,6,5,2.02E+11,0.092,mg/mÂ³,170,1 Hr,442920,99999,2.02E+11,160,13,,250,,,,,6.2,,,,,,,,,,27,0,,30.33,,,,,,,,
Ulaanbaatar_ HourlyPM25_201511.CSV,Ulaanbaatar,2/5/2018 12:00,11/6/2015 6:00,2015,11,6,6,2.02E+11,0.076,mg/mÂ³,162,1 Hr,442920,99999,2.02E+11,160,13,,250,BKN,,,,12.5,4,,,,,,,,2,30,1,1034.5,,878,,,,,,,
Ulaanbaatar_ HourlyPM25_201511.CSV,Ulaanbaatar,2/5/2018 12:00,11/6/2015 7:00,2015,11,6,7,2.02E+11,0.071,mg/mÂ³,159,1 Hr,442920,99999,2.02E+11,170,11,,,,,,,6.2,,,,,,,,,,30,0,,30.3,,,,,,,,
Ulaanbaatar_ HourlyPM25_201511.CSV,Ulaanbaatar,2/5/2018 12:00,11/6/2015 8:00,2015,11,6,8,2.02E+11,0.139,mg/mÂ³,194,1 Hr,442920,99999,2.02E+11,160,13,,,,,,,6.2,,,,,,,,,,30,1,,30.27,,,,,,,,
Ulaanbaatar_ HourlyPM25_201511.CSV,Ulaanbaatar,2/5/2018 12:00,11/6/2015 9:00,2015,11,6,9,2.02E+11,0.358,mg/mÂ³,387,1 Hr,442920,99999,2.02E+11,,,,100,,,,,6.2,4,,,,,,,,2,28,1,1033.1,30.27,,,,,,,,
Ulaanbaatar_ HourlyPM25_201511.CSV,Ulaanbaatar,2/5/2018 12:00,11/6/2015 10:00,2015,11,6,10,2.02E+11,0.21,mg/mÂ³,260,1 Hr,442920,99999,2.02E+11,150,11,,100,,,,,6.2,,,,,,,,,,25,1,,30.27,,,,,,,,
Ulaanbaatar_ HourlyPM25_201511.CSV,Ulaanbaatar,2/5/2018 12:00,11/6/2015 11:00,2015,11,6,11,2.02E+11,0.032,mg/mÂ³,93,1 Hr,442920,99999,2.02E+11,150,16,,100,,,,,6.2,,,,,,,,,,25,1,,30.27,,,,,,,,
Ulaanbaatar_ HourlyPM25_201511.CSV,Ulaanbaatar,2/5/2018 12:00,11/6/2015 12:00,2015,11,6,12,2.02E+11,0.024,mg/mÂ³,76,1 Hr,442920,99999,2.02E+11,150,16,,100,,,,,6.2,,,,,,,,,,25,0,1035.1,30.3,,32,,,,,,
Ulaanbaatar_ HourlyPM25_201511.CSV,Ulaanbaatar,2/5/2018 12:00,11/6/2015 13:00,2015,11,6,13,2.02E+11,0.025,mg/mÂ³,78,1 Hr,442920,99999,2.02E+11,140,13,,100,,,,,6.2,,,,,,,,,,25,0,,30.3,,,,,,,,
Ulaanbaatar_ HourlyPM25_201511.CSV,Ulaanbaatar,2/5/2018 12:00,11/6/2015 14:00,2015,11,6,14,2.02E+11,0.013,mg/mÂ³,53,1 Hr,442920,99999,2.02E+11,150,13,,100,,,,,6.2,,,,,,,,,,25,0,,30.27,,,,,,,,
Ulaanbaatar_ HourlyPM25_201511.CSV,Ulaanbaatar,2/5/2018 12:00,11/6/2015 15:00,2015,11,6,15,2.02E+11,0.018,mg/mÂ³,63,1 Hr,442920,99999,2.02E+11,150,7,,100,,,,,6.2,,,,,,,,,,25,-2,1035.2,30.27,,,,,,,,
Ulaanbaatar_ HourlyPM25_201511.CSV,Ulaanbaatar,2/5/2018 12:00,11/6/2015 16:00,2015,11,6,16,2.02E+11,0.02,mg/mÂ³,68,1 Hr,442920,99999,2.02E+11,130,9,,100,,,,,6.2,,,,,,,,,,25,-2,,30.27,,,,,,,,
Ulaanbaatar_ HourlyPM25_201511.CSV,Ulaanbaatar,2/5/2018 12:00,11/6/2015 17:00,2015,11,6,17,2.02E+11,0.022,mg/mÂ³,72,1 Hr,442920,99999,2.02E+11,150,13,,100,,,,,6.2,,,,,,,,,,23,-2,,30.27,,,,,,,,
Ulaanbaatar_ HourlyPM25_201511.CSV,Ulaanbaatar,2/5/2018 12:00,11/6/2015 18:00,2015,11,6,18,2.02E+11,0.043,mg/mÂ³,119,1 Hr,442920,99999,2.02E+11,150,11,,,BKN,,,,6.2,,,,,,,,,,23,-3,1034.7,30.24,,,,,,,,
Ulaanbaatar_ HourlyPM25_201511.CSV,Ulaanbaatar,2/5/2018 12:00,11/6/2015 19:00,2015,11,6,19,2.02E+11,0.035,mg/mÂ³,99,1 Hr,442920,99999,2.02E+11,150,13,,,,,,,6.2,,,,,,,,,,21,-4,,30.21,,,,,,,,
Ulaanbaatar_ HourlyPM25_201511.CSV,Ulaanbaatar,2/5/2018 12:00,11/6/2015 20:00,2015,11,6,20,2.02E+11,0.035,mg/mÂ³,99,1 Hr,442920,99999,2.02E+11,140,11,,,,,,,6.2,,,,,,,,,,21,-4,,30.21,,,,,,,,
Ulaanbaatar_ HourlyPM25_201511.CSV,Ulaanbaatar,2/5/2018 12:00,11/6/2015 21:00,2015,11,6,21,2.02E+11,0.036,mg/mÂ³,102,1 Hr,442920,99999,2.02E+11,70,4,,,SCT,,,,31.2,,,,,,,,,,21,-4,1034.3,30.21,,,,,,,,
Ulaanbaatar_ HourlyPM25_201511.CSV,Ulaanbaatar,2/5/2018 12:00,11/6/2015 22:00,2015,11,6,22,2.02E+11,0.029,mg/mÂ³,87,1 Hr,442920,99999,2.02E+11,150,11,,,,,,,,,,,,,,,,,21,-4,,30.21,,,,,,,,
Ulaanbaatar_ HourlyPM25_201511.CSV,Ulaanbaatar,2/5/2018 12:00,11/6/2015 23:00,2015,11,6,23,2.02E+11,0.021,mg/mÂ³,70,1 Hr,442920,99999,2.02E+11,150,13,,,,,,,6.2,,,,,,,,,,23,-4,,30.18,,,,,,,,
Ulaanbaatar_ HourlyPM25_201511.CSV,Ulaanbaatar,2/5/2018 12:00,11/7/2015 0:00,2015,11,7,0,2.02E+11,0.025,mg/mÂ³,78,1 Hr,442920,99999,2.02E+11,60,4,,100,BKN,,,,6.2,,,,,,,,,,21,-4,1033.8,30.21,,,20,,,,,
Ulaanbaatar_ HourlyPM25_201511.CSV,Ulaanbaatar,2/5/2018 12:00,11/7/2015 1:00,2015,11,7,1,2.02E+11,0.02,mg/mÂ³,68,1 Hr,442920,99999,2.02E+11,160,11,,100,,,,,6.2,,,,,,,,,,23,-4,,30.21,,,,,,,,
Ulaanbaatar_ HourlyPM25_201511.CSV,Ulaanbaatar,2/5/2018 12:00,11/7/2015 2:00,2015,11,7,2,2.02E+11,0.02,mg/mÂ³,68,1 Hr,442920,99999,2.02E+11,990,11,,,,,,,6.2,,,,,,,,,,25,-4,,30.18,,,,,,,,
Ulaanbaatar_ HourlyPM25_201511.CSV,Ulaanbaatar,2/5/2018 12:00,11/7/2015 3:00,2015,11,7,3,2.02E+11,0.023,mg/mÂ³,74,1 Hr,442920,99999,2.02E+11,100,4,,100,,,,,6.2,4,,,,,,,,2,27,-4,1031.5,30.18,,,,,,,,
Ulaanbaatar_ HourlyPM25_201511.CSV,Ulaanbaatar,2/5/2018 12:00,11/7/2015 4:00,2015,11,7,4,2.02E+11,0.044,mg/mÂ³,122,1 Hr,442920,99999,2.02E+11,160,11,,100,,,,,6.2,,,,,,,,,,28,0,,30.18,,,,,,,,
Ulaanbaatar_ HourlyPM25_201511.CSV,Ulaanbaatar,2/5/2018 12:00,11/7/2015 5:00,2015,11,7,5,2.02E+11,0.025,mg/mÂ³,78,1 Hr,442920,99999,2.02E+11,990,9,,100,,,,,6.2,,,,,,,,,,28,1,,30.15,,,,,,,,
Ulaanbaatar_ HourlyPM25_201511.CSV,Ulaanbaatar,2/5/2018 12:00,11/7/2015 6:00,2015,11,7,6,2.02E+11,0.074,mg/mÂ³,161,1 Hr,442920,99999,2.02E+11,100,2,,250,,,,,6.2,4,,,,,,,,2,32,2,1027.8,30.12,,,,,,,,
Ulaanbaatar_ HourlyPM25_201511.CSV,Ulaanbaatar,2/5/2018 12:00,11/7/2015 7:00,2015,11,7,7,2.02E+11,0.053,mg/mÂ³,144,1 Hr,442920,99999,2.02E+11,170,7,,250,,,,,6.2,,,,,,,,,,32,1,,30.09,,,,,,,,
Ulaanbaatar_ HourlyPM25_201511.CSV,Ulaanbaatar,2/5/2018 12:00,11/7/2015 8:00,2015,11,7,8,2.02E+11,0.039,mg/mÂ³,110,1 Hr,442920,99999,2.02E+11,210,9,,250,,,,,6.2,,,,,,,,,,32,1,,30.09,,,,,,,,
Ulaanbaatar_ HourlyPM25_201511.CSV,Ulaanbaatar,2/5/2018 12:00,11/7/2015 9:00,2015,11,7,9,2.02E+11,,mg/mÂ³,,1 Hr,442920,99999,2.02E+11,140,4,,,SCT,,,,31.2,,,,,,,,,,32,9,1026.3,30.09,,,,,,,,
Ulaanbaatar_ HourlyPM25_201511.CSV,Ulaanbaatar,2/5/2018 12:00,11/7/2015 10:00,2015,11,7,10,2.02E+11,0.033,mg/mÂ³,95,1 Hr,442920,99999,2.02E+11,200,4,,,,,,,,,,,,,,,,,23,10,,30.09,,,,,,,,
Ulaanbaatar_ HourlyPM25_201511.CSV,Ulaanbaatar,2/5/2018 12:00,11/7/2015 11:00,2015,11,7,11,2.02E+11,0.028,mg/mÂ³,84,1 Hr,442920,99999,2.02E+11,170,9,,,,,,,,,,,,,,,,,23,12,,30.09,,,,,,,,
Ulaanbaatar_ HourlyPM25_201511.CSV,Ulaanbaatar,2/5/2018 12:00,11/7/2015 12:00,2015,11,7,12,2.02E+11,0.02,mg/mÂ³,68,1 Hr,442920,99999,2.02E+11,90,4,,,BKN,,,,,,,,,,,,,,27,14,1028.8,,872.2,33,,,,,,
Ulaanbaatar_ HourlyPM25_201511.CSV,Ulaanbaatar,2/5/2018 12:00,11/7/2015 13:00,2015,11,7,13,2.02E+11,0.027,mg/mÂ³,82,1 Hr,442920,99999,2.02E+11,,0,,,,,,,6.2,,,,,,,,,,25,10,,30.09,,,,,,,,
Ulaanbaatar_ HourlyPM25_201511.CSV,Ulaanbaatar,2/5/2018 12:00,11/7/2015 14:00,2015,11,7,14,2.02E+11,0.029,mg/mÂ³,87,1 Hr,442920,99999,2.02E+11,990,2,,,,,,,6.2,,,,,,,,,,19,10,,30.09,,,,,,,,
Ulaanbaatar_ HourlyPM25_201511.CSV,Ulaanbaatar,2/5/2018 12:00,11/7/2015 15:00,2015,11,7,15,2.02E+11,0.028,mg/mÂ³,84,1 Hr,442920,99999,2.02E+11,70,2,,,,,,,6.2,,,,,,,,,,19,10,1029.6,30.09,,,,,,,,
Ulaanbaatar_ HourlyPM25_201511.CSV,Ulaanbaatar,2/5/2018 12:00,11/7/2015 16:00,2015,11,7,16,2.02E+11,0.024,mg/mÂ³,76,1 Hr,442920,99999,2.02E+11,,0,,,,,,,6.2,,,,,,,,,,12,9,,30.09,,,,,,,,
Ulaanbaatar_ HourlyPM25_201511.CSV,Ulaanbaatar,2/5/2018 12:00,11/7/2015 17:00,2015,11,7,17,2.02E+11,0.019,mg/mÂ³,66,1 Hr,442920,99999,2.02E+11,,0,,,,,,,6.2,,,,,,,,,,10,7,,30.06,,,,,,,,
Ulaanbaatar_ HourlyPM25_201511.CSV,Ulaanbaatar,2/5/2018 12:00,11/7/2015 18:00,2015,11,7,18,2.02E+11,0.037,mg/mÂ³,105,1 Hr,442920,99999,2.02E+11,80,7,,,,,,,31.2,,,,,,,,,,14,9,1029.5,30.06,,,,,,,,
Ulaanbaatar_ HourlyPM25_201511.CSV,Ulaanbaatar,2/5/2018 12:00,11/7/2015 19:00,2015,11,7,19,2.02E+11,0.04,mg/mÂ³,112,1 Hr,442920,99999,2.02E+11,990,2,,,,,,,,,,,,,,,,,9,5,,30.06,,,,,,,,
Ulaanbaatar_ HourlyPM25_201511.CSV,Ulaanbaatar,2/5/2018 12:00,11/7/2015 20:00,2015,11,7,20,2.02E+11,0.203,mg/mÂ³,253,1 Hr,442920,99999,2.02E+11,,0,,,,,,,,,,,,,,,,,10,7,,30.06,,,,,,,,
Ulaanbaatar_ HourlyPM25_201511.CSV,Ulaanbaatar,2/5/2018 12:00,11/7/2015 21:00,2015,11,7,21,2.02E+11,0.16,mg/mÂ³,210,1 Hr,442920,99999,2.02E+11,70,7,,,,,,,31.2,,,,,,,,,,7,3,1030,30.06,,,,,,,,
Ulaanbaatar_ HourlyPM25_201511.CSV,Ulaanbaatar,2/5/2018 12:00,11/7/2015 22:00,2015,11,7,22,2.02E+11,0.15,mg/mÂ³,200,1 Hr,442920,99999,2.02E+11,990,2,,,,,,,,,,,,,,,,,5,1,,30.06,,,,,,,,
Ulaanbaatar_ HourlyPM25_201511.CSV,Ulaanbaatar,2/5/2018 12:00,11/7/2015 23:00,2015,11,7,23,2.02E+11,0.16,mg/mÂ³,210,1 Hr,442920,99999,2.02E+11,990,2,,,,,,,,,,,,,,,,,7,1,,30.06,,,,,,,,
Ulaanbaatar_ HourlyPM25_201511.CSV,Ulaanbaatar,2/5/2018 12:00,11/8/2015 0:00,2015,11,8,0,2.02E+11,0.185,mg/mÂ³,235,1 Hr,442920,99999,2.02E+11,80,4,,,SCT,,,,31.2,,,,,,,,,,16,3,1031,30.06,,,16,,,,,
Ulaanbaatar_ HourlyPM25_201511.CSV,Ulaanbaatar,2/5/2018 12:00,11/8/2015 1:00,2015,11,8,1,2.02E+11,0.154,mg/mÂ³,204,1 Hr,442920,99999,2.02E+11,990,2,,,,,,,,,,,,,,,,,10,5,,30.09,,,,,,,,
Ulaanbaatar_ HourlyPM25_201511.CSV,Ulaanbaatar,2/5/2018 12:00,11/8/2015 2:00,2015,11,8,2,2.02E+11,0.119,mg/mÂ³,184,1 Hr,442920,99999,2.02E+11,990,2,,722,CLR,,,,5,,,,,,,,,,16,10,,30.09,,,,,,,,
Ulaanbaatar_ HourlyPM25_201511.CSV,Ulaanbaatar,2/5/2018 12:00,11/8/2015 3:00,2015,11,8,3,2.02E+11,0.085,mg/mÂ³,166,1 Hr,442920,99999,2.02E+11,100,4,,722,CLR,,,,6.2,4,,,,,,,,0,25,11,1028.2,,871.2,,,,,,,
Ulaanbaatar_ HourlyPM25_201511.CSV,Ulaanbaatar,2/5/2018 12:00,11/8/2015 4:00,2015,11,8,4,2.02E+11,0.074,mg/mÂ³,161,1 Hr,442920,99999,2.02E+11,,0,,722,CLR,,,,5,,,,,,,,,,27,14,,30.09,,,,,,,,
Ulaanbaatar_ HourlyPM25_201511.CSV,Ulaanbaatar,2/5/2018 12:00,11/8/2015 5:00,2015,11,8,5,2.02E+11,0.082,mg/mÂ³,165,1 Hr,442920,99999,2.02E+11,,0,,,,,,,,,,,,,,,,,28,14,,30.06,,,,,,,,
Ulaanbaatar_ HourlyPM25_201511.CSV,Ulaanbaatar,2/5/2018 12:00,11/8/2015 6:00,2015,11,8,6,2.02E+11,0.07,mg/mÂ³,158,1 Hr,442920,99999,2.02E+11,250,4,,,,,,,6.2,4,,,,,,,,0,33,12,1024.6,30.03,,,,,,,,
Ulaanbaatar_ HourlyPM25_201511.CSV,Ulaanbaatar,2/5/2018 12:00,11/8/2015 7:00,2015,11,8,7,2.02E+11,0.059,mg/mÂ³,153,1 Hr,442920,99999,2.02E+11,250,7,,,,,,,,,,,,,,,,,34,12,,30.03,,,,,,,,
Ulaanbaatar_ HourlyPM25_201511.CSV,Ulaanbaatar,2/5/2018 12:00,11/8/2015 8:00,2015,11,8,8,2.02E+11,0.08,mg/mÂ³,164,1 Hr,442920,99999,2.02E+11,250,7,,,,,,,,,,,,,,,,,34,12,,30.03,,,,,,,,
Ulaanbaatar_ HourlyPM25_201511.CSV,Ulaanbaatar,2/5/2018 12:00,11/8/2015 9:00,2015,11,8,9,2.02E+11,0.139,mg/mÂ³,194,1 Hr,442920,99999,2.02E+11,990,2,,,,,,,12.5,4,,,,,,,,0,34,14,1023.8,,870.1,,,,,,,
Ulaanbaatar_ HourlyPM25_201511.CSV,Ulaanbaatar,2/5/2018 12:00,11/8/2015 10:00,2015,11,8,10,2.02E+11,0.237,mg/mÂ³,287,1 Hr,442920,99999,2.02E+11,170,7,,,,,,,,,,,,,,,,,23,16,,30.03,,,,,,,,
Ulaanbaatar_ HourlyPM25_201511.CSV,Ulaanbaatar,2/5/2018 12:00,11/8/2015 11:00,2015,11,8,11,2.02E+11,0.033,mg/mÂ³,95,1 Hr,442920,99999,2.02E+11,160,4,,,,,,,,,,,,,,,,,21,14,,30.06,,,,,,,,
Ulaanbaatar_ HourlyPM25_201511.CSV,Ulaanbaatar,2/5/2018 12:00,11/8/2015 12:00,2015,11,8,12,2.02E+11,0.037,mg/mÂ³,105,1 Hr,442920,99999,2.02E+11,990,2,,,,,,,31.2,,,,,,,,,,26,15,1027.7,,871.2,36,,,,,,
Ulaanbaatar_ HourlyPM25_201511.CSV,Ulaanbaatar,2/5/2018 12:00,11/8/2015 13:00,2015,11,8,13,2.02E+11,0.037,mg/mÂ³,105,1 Hr,442920,99999,2.02E+11,,0,,,,,,,,,,,,,,,,,18,12,,30.06,,,,,,,,
Ulaanbaatar_ HourlyPM25_201511.CSV,Ulaanbaatar,2/5/2018 12:00,11/8/2015 14:00,2015,11,8,14,2.02E+11,0.039,mg/mÂ³,110,1 Hr,442920,99999,2.02E+11,,0,,,,,,,,,,,,,,,,,16,10,,30.09,,,,,,,,
Ulaanbaatar_ HourlyPM25_201511.CSV,Ulaanbaatar,2/5/2018 12:00,11/8/2015 15:00,2015,11,8,15,2.02E+11,0.066,mg/mÂ³,156,1 Hr,442920,99999,2.02E+11,990,2,,,,,,,31.2,,,,,,,,,,23,14,1029.4,,871.5,,,,,,,
Ulaanbaatar_ HourlyPM25_201511.CSV,Ulaanbaatar,2/5/2018 12:00,11/8/2015 16:00,2015,11,8,16,2.02E+11,0.026,mg/mÂ³,80,1 Hr,442920,99999,2.02E+11,990,2,,,,,,,,,,,,,,,,,10,7,,30.09,,,,,,,,
Ulaanbaatar_ HourlyPM25_201511.CSV,Ulaanbaatar,2/5/2018 12:00,11/8/2015 17:00,2015,11,8,17,2.02E+11,0.029,mg/mÂ³,87,1 Hr,442920,99999,2.02E+11,990,2,,,,,,,,,,,,,,,,,10,7,,30.06,,,,,,,,
Ulaanbaatar_ HourlyPM25_201511.CSV,Ulaanbaatar,2/5/2018 12:00,11/8/2015 18:00,2015,11,8,18,2.02E+11,0.051,mg/mÂ³,139,1 Hr,442920,99999,2.02E+11,990,2,,,,,,,31.2,,,,,,,,,,12,13,1030.1,30.06,,,,,,,,
Ulaanbaatar_ HourlyPM25_201511.CSV,Ulaanbaatar,2/5/2018 12:00,11/8/2015 19:00,2015,11,8,19,2.02E+11,0.259,mg/mÂ³,308,1 Hr,442920,99999,2.02E+11,,0,,,,,,,,,,,,,,,,,12,9,,30.09,,,,,,,,
Ulaanbaatar_ HourlyPM25_201511.CSV,Ulaanbaatar,2/5/2018 12:00,11/8/2015 20:00,2015,11,8,20,2.02E+11,0.205,mg/mÂ³,255,1 Hr,442920,99999,2.02E+11,,0,,,,,,,,,,,,,,,,,10,7,,30.06,,,,,,,,
Ulaanbaatar_ HourlyPM25_201511.CSV,Ulaanbaatar,2/5/2018 12:00,11/8/2015 21:00,2015,11,8,21,2.02E+11,0.178,mg/mÂ³,228,1 Hr,442920,99999,2.02E+11,,0,,,,,,,31.2,,,,,,,,,,9,5,1030.3,30.06,,,,,,,,
Ulaanbaatar_ HourlyPM25_201511.CSV,Ulaanbaatar,2/5/2018 12:00,11/8/2015 22:00,2015,11,8,22,2.02E+11,0.22,mg/mÂ³,270,1 Hr,442920,99999,2.02E+11,990,2,,,,,,,,,,,,,,,,,9,3,,30.06,,,,,,,,
Ulaanbaatar_ HourlyPM25_201511.CSV,Ulaanbaatar,2/5/2018 12:00,11/8/2015 23:00,2015,11,8,23,2.02E+11,0.182,mg/mÂ³,232,1 Hr,442920,99999,2.02E+11,,0,,,,,,,,,,,,,,,,,5,1,,30.06,,,,,,,,
Ulaanbaatar_ HourlyPM25_201511.CSV,Ulaanbaatar,2/5/2018 12:00,11/9/2015 0:00,2015,11,9,0,2.02E+11,0.19,mg/mÂ³,240,1 Hr,442920,99999,2.02E+11,,,,,SCT,,,,6.2,4,,,,,,,,0,5,1,1030.9,30.06,,,,,,,,
Ulaanbaatar_ HourlyPM25_201511.CSV,Ulaanbaatar,2/5/2018 12:00,11/9/2015 1:00,2015,11,9,1,2.02E+11,0.17,mg/mÂ³,220,1 Hr,442920,99999,2.02E+11,990,2,,250,,,,,6.2,,,,,,,,,,12,7,,30.06,,,,,,,,
Ulaanbaatar_ HourlyPM25_201511.CSV,Ulaanbaatar,2/5/2018 12:00,11/9/2015 2:00,2015,11,9,2,2.02E+11,0.163,mg/mÂ³,213,1 Hr,442920,99999,2.02E+11,990,2,,250,,,,,5,,,,,,,,,,16,9,,30.06,,,,,,,,
Ulaanbaatar_ HourlyPM25_201511.CSV,Ulaanbaatar,2/5/2018 12:00,11/9/2015 3:00,2015,11,9,3,2.02E+11,0.099,mg/mÂ³,173,1 Hr,442920,99999,2.02E+11,,0,,250,,,,,5,4,,,,,,,,2,19,12,1026.7,30.06,,,,,,,,
Ulaanbaatar_ HourlyPM25_201511.CSV,Ulaanbaatar,2/5/2018 12:00,11/9/2015 4:00,2015,11,9,4,2.02E+11,0.124,mg/mÂ³,186,1 Hr,442920,99999,2.02E+11,,0,,250,,,,,5,,,,,,,,,,25,14,,30.03,,,,,,,,
Ulaanbaatar_ HourlyPM25_201511.CSV,Ulaanbaatar,2/5/2018 12:00,11/9/2015 5:00,2015,11,9,5,2.02E+11,0.082,mg/mÂ³,165,1 Hr,442920,99999,2.02E+11,,0,,,,,,,6.2,,,,,,,,,,28,16,,30,,,,,,,,
Ulaanbaatar_ HourlyPM25_201511.CSV,Ulaanbaatar,2/5/2018 12:00,11/9/2015 6:00,2015,11,9,6,2.02E+11,0.061,mg/mÂ³,154,1 Hr,442920,99999,2.02E+11,990,2,,100,,,,,6.2,4,,,,,,,,2,32,14,1021.4,29.97,,,,,,,,
Ulaanbaatar_ HourlyPM25_201511.CSV,Ulaanbaatar,2/5/2018 12:00,11/9/2015 7:00,2015,11,9,7,2.02E+11,0.08,mg/mÂ³,164,1 Hr,442920,99999,2.02E+11,170,4,,100,,,,,6.2,,,,,,,,,,32,16,,29.97,,,,,,,,
Ulaanbaatar_ HourlyPM25_201511.CSV,Ulaanbaatar,2/5/2018 12:00,11/9/2015 8:00,2015,11,9,8,2.02E+11,0.123,mg/mÂ³,186,1 Hr,442920,99999,2.02E+11,990,2,,100,,,,,6.2,,,,,,,,,,32,16,,29.97,,,,,,,,
Ulaanbaatar_ HourlyPM25_201511.CSV,Ulaanbaatar,2/5/2018 12:00,11/9/2015 9:00,2015,11,9,9,2.02E+11,0.207,mg/mÂ³,257,1 Hr,442920,99999,2.02E+11,,,,100,,,,,6.2,4,,,,,,,,2,32,13,1020.6,29.97,,,,,,,,
Ulaanbaatar_ HourlyPM25_201511.CSV,Ulaanbaatar,2/5/2018 12:00,11/9/2015 10:00,2015,11,9,10,2.02E+11,0.146,mg/mÂ³,198,1 Hr,442920,99999,2.02E+11,990,4,,100,,,,,6.2,,,,,,,,,,32,16,,29.97,,,,,,,,
Ulaanbaatar_ HourlyPM25_201511.CSV,Ulaanbaatar,2/5/2018 12:00,11/9/2015 11:00,2015,11,9,11,2.02E+11,0.042,mg/mÂ³,117,1 Hr,442920,99999,2.02E+11,990,4,,100,,,,,6.2,,,,,,,,,,28,19,,30,,,,,,,,
Ulaanbaatar_ HourlyPM25_201511.CSV,Ulaanbaatar,2/5/2018 12:00,11/9/2015 12:00,2015,11,9,12,2.02E+11,0.038,mg/mÂ³,107,1 Hr,442920,99999,2.02E+11,,,,100,,,,,6.2,,,,,,,,,,27,19,1023.5,30,,37,,,,,,
Ulaanbaatar_ HourlyPM25_201511.CSV,Ulaanbaatar,2/5/2018 12:00,11/9/2015 13:00,2015,11,9,13,2.02E+11,0.034,mg/mÂ³,97,1 Hr,442920,99999,2.02E+11,990,2,,,,,,,6.2,,,,,,,,,,25,18,,30.03,,,,,,,,
Ulaanbaatar_ HourlyPM25_201511.CSV,Ulaanbaatar,2/5/2018 12:00,11/9/2015 14:00,2015,11,9,14,2.02E+11,0.036,mg/mÂ³,102,1 Hr,442920,99999,2.02E+11,340,7,,,,,,,6.2,,,,,,,,,,28,19,,30.06,,,,,,,,
Ulaanbaatar_ HourlyPM25_201511.CSV,Ulaanbaatar,2/5/2018 12:00,11/9/2015 15:00,2015,11,9,15,2.02E+11,0.029,mg/mÂ³,87,1 Hr,442920,99999,2.02E+11,,,,,,,,,6.2,,,,,,,,,,28,23,1025.7,30.06,,,,,,,,
Ulaanbaatar_ HourlyPM25_201511.CSV,Ulaanbaatar,2/5/2018 12:00,11/9/2015 16:00,2015,11,9,16,2.02E+11,0.039,mg/mÂ³,110,1 Hr,442920,99999,2.02E+11,990,2,,,,,,,6.2,,,,,,,,,,19,16,,30.06,,,,,,,,
Ulaanbaatar_ HourlyPM25_201511.CSV,Ulaanbaatar,2/5/2018 12:00,11/9/2015 17:00,2015,11,9,17,2.02E+11,0.093,mg/mÂ³,170,1 Hr,442920,99999,2.02E+11,990,4,,,,,,,,,,,,,,,,,16,14,,30.06,,,,,,,,
Ulaanbaatar_ HourlyPM25_201511.CSV,Ulaanbaatar,2/5/2018 12:00,11/9/2015 18:00,2015,11,9,18,2.02E+11,0.169,mg/mÂ³,219,1 Hr,442920,99999,2.02E+11,,,,,SCT,,,,31.2,,,,,,,,,,16,12,1029.3,30.06,,,,,,,,
